text,intent
Is Tata Steel stock sentiment favorable?,stock_sentiment
What’s the general market sentiment on Meta stock?,stock_sentiment
Are investors positive or negative on Axis Bank stock?,stock_sentiment
Tell me if Flipkart stock is trending up.,stock_sentiment
Tell me if Microsoft shares are favored by investors.,stock_sentiment
Analyze Tata Motors’s stock sentiment from recent news.,stock_sentiment
Is ONGC stock sentiment favorable?,stock_sentiment
Tell me if Amazon is going up or down.,stock_sentiment
Tell me if Uber stock is trending up.,stock_sentiment
Is Zomato stock getting good reviews from traders?,stock_sentiment
What’s the investor sentiment on Infosys stock?,stock_sentiment
Are Bharat Electronics shares viewed positively right now?,stock_sentiment
Is Tech Mahindra stock getting good reviews from traders?,stock_sentiment
Is ICICI Bank stock showing bullish signs?,stock_sentiment
What’s the investor mood around Microsoft stock?,stock_sentiment
What’s the mood around Tech Mahindra stock today?,stock_sentiment
What’s the public sentiment for Marico shares?,stock_sentiment
How are Uber shares perceived by traders?,stock_sentiment
How are Flipkart shares perceived by traders?,stock_sentiment
How is the market feeling about Tata Motors?,stock_sentiment
Is Apple stock trending positively?,stock_sentiment
How are people reacting to Amazon shares?,stock_sentiment
Is Adani Enterprises stock getting good reviews from traders?,stock_sentiment
How are people reacting to Uber shares?,stock_sentiment
Is SBI stock trending positively?,stock_sentiment
How is Adani Enterprises stock sentiment trending?,stock_sentiment
Analyze Asian Paints’s stock sentiment from recent news.,stock_sentiment
What’s the investor sentiment on Tata Motors stock?,stock_sentiment
What’s the investor sentiment for Apple today?,stock_sentiment
What’s the general market sentiment on Netflix stock?,stock_sentiment
What’s the investor sentiment for Dell today?,stock_sentiment
Tell me if Tesla shares are favored by investors.,stock_sentiment
Check if Microsoft stock is receiving positive feedback.,stock_sentiment
What’s the investor mood around Uber stock?,stock_sentiment
Check if ICICI Bank stock is receiving positive feedback.,stock_sentiment
How are people reacting to Axis Bank shares?,stock_sentiment
What’s the mood around Tata Elxsi stock today?,stock_sentiment
What’s the mood around Bharat Electronics stock today?,stock_sentiment
Is the LIC stock sentiment bullish or bearish?,stock_sentiment
Is NTPC stock showing positive signs?,stock_sentiment
Analyze Twitter stock sentiment from social media.,stock_sentiment
How is Amazon stock sentiment trending?,stock_sentiment
What’s the mood around ONGC stock today?,stock_sentiment
Is Paytm stock bullish or bearish?,stock_sentiment
How is the sentiment on Reliance Industries shares?,stock_sentiment
Are Tata Elxsi shares in a bullish mood?,stock_sentiment
Is HDFC Bank stock getting good reviews from traders?,stock_sentiment
What’s the mood around Tata Elxsi stock today?,stock_sentiment
Is Facebook stock showing bullish signs?,stock_sentiment
How is the sentiment on Zomato stock evolving?,stock_sentiment
Tell me if Uber shares are favored by investors.,stock_sentiment
Are investors positive or negative on Meta stock?,stock_sentiment
Give me the current sentiment for JSW Steel shares.,stock_sentiment
What’s the investor sentiment for Tech Mahindra today?,stock_sentiment
Tell me if Axis Bank is going up or down.,stock_sentiment
Analyze Amazon’s stock sentiment from recent news.,stock_sentiment
Is the Bharat Electronics stock sentiment bullish or bearish?,stock_sentiment
Is the Adani Enterprises stock sentiment bullish or bearish?,stock_sentiment
What’s the investor sentiment for Tesla today?,stock_sentiment
How are people reacting to ICICI Bank shares?,stock_sentiment
Is Flipkart stock trending positively?,stock_sentiment
Are Flipkart shares favored in today’s market?,stock_sentiment
Are Bharti Airtel shares viewed positively right now?,stock_sentiment
Are traders optimistic about BYJU’s stock?,stock_sentiment
Check the sentiment for Tata Steel stock.,stock_sentiment
Are Infosys shares trending bullish currently?,stock_sentiment
How is the market feeling about Tata Elxsi?,stock_sentiment
How are ICICI Bank shares perceived by traders?,stock_sentiment
What is the sentiment of Tech Mahindra stock?,stock_sentiment
Give me the current sentiment for ICICI Bank shares.,stock_sentiment
How is Flipkart stock sentiment trending?,stock_sentiment
Are Ashok Leyland shares in a bullish mood?,stock_sentiment
Check if Netflix stock is receiving positive feedback.,stock_sentiment
How are people reacting to Dell shares?,stock_sentiment
Check the sentiment for Vedanta stock.,stock_sentiment
What’s the investor mood around HUL stock?,stock_sentiment
How is Amazon stock sentiment trending?,stock_sentiment
How do investors feel about Bharti Airtel stock recently?,stock_sentiment
What’s the investor sentiment on Meta stock?,stock_sentiment
Are Reliance Industries shares viewed positively right now?,stock_sentiment
Are Asian Paints shares favored in today’s market?,stock_sentiment
Are investors positive or negative on HUL stock?,stock_sentiment
Give me sentiment analysis for Microsoft stock.,stock_sentiment
Are ICICI Bank shares viewed positively right now?,stock_sentiment
Tell me if Marico stock is trending up.,stock_sentiment
Are investors confident in Reliance Industries shares?,stock_sentiment
How do investors feel about Dell stock recently?,stock_sentiment
How do investors feel about Infosys stock recently?,stock_sentiment
How are people reacting to Google shares?,stock_sentiment
Is the Asian Paints stock sentiment bullish or bearish?,stock_sentiment
What’s the public sentiment for Reliance Industries shares?,stock_sentiment
What’s the investor sentiment for HUL today?,stock_sentiment
Are Tech Mahindra shares seeing positive sentiment?,stock_sentiment
Give me the current sentiment for Apple shares.,stock_sentiment
Are NTPC shares viewed positively right now?,stock_sentiment
What’s the investor sentiment for ITC today?,stock_sentiment
How is the market feeling about Wipro?,stock_sentiment
What’s the general market sentiment on Tech Mahindra stock?,stock_sentiment
Are traders optimistic about Netflix stock?,stock_sentiment
How is Netflix stock sentiment trending?,stock_sentiment
What’s the investor mood around Bajaj Finance stock?,stock_sentiment
Is Uber stock viewed as bullish currently?,stock_sentiment
What’s the public sentiment for Wipro shares?,stock_sentiment
Is Tata Motors stock sentiment positive or negative?,stock_sentiment
Analyze the stock sentiment for NTPC.,stock_sentiment
Check the sentiment for BYJU’s stock.,stock_sentiment
What’s the public sentiment for Marico shares?,stock_sentiment
Analyze BYJU’s’s stock sentiment from recent news.,stock_sentiment
Is Bajaj Finance stock trending positively?,stock_sentiment
How are SBI shares perceived by traders?,stock_sentiment
What’s the investor sentiment for Maruti Suzuki today?,stock_sentiment
Analyze the stock sentiment for ICICI Bank.,stock_sentiment
How is the sentiment on BYJU’s stock evolving?,stock_sentiment
Give me sentiment analysis for Britannia stock.,stock_sentiment
Check if Infosys stock is receiving positive feedback.,stock_sentiment
Is ITC stock trending positively?,stock_sentiment
Give me the current sentiment for Uber shares.,stock_sentiment
How is the market sentiment for Zomato stocks?,stock_sentiment
Analyze Meta stock sentiment from social media.,stock_sentiment
Are investors confident in ITC shares?,stock_sentiment
What’s the investor mood around TCS stock?,stock_sentiment
Are Vedanta shares viewed positively right now?,stock_sentiment
Tell me if Flipkart shares are favored by investors.,stock_sentiment
What’s the investor sentiment on Apple stock?,stock_sentiment
Are Meta shares viewed positively right now?,stock_sentiment
Are Infosys shares seeing increased investor confidence?,stock_sentiment
Analyze the stock sentiment for Paytm.,stock_sentiment
Is Google stock showing bullish signs?,stock_sentiment
Are Maruti Suzuki shares trending bullish currently?,stock_sentiment
What’s the investor mood around BYJU’s stock?,stock_sentiment
How are Tata Motors shares perceived by traders?,stock_sentiment
What’s the mood around Nvidia stock today?,stock_sentiment
Tell me if HDFC Bank shares are favored by investors.,stock_sentiment
What is the sentiment of Tesla stock?,stock_sentiment
How are Ashok Leyland shares perceived by traders?,stock_sentiment
How are Tata Elxsi shares perceived by traders?,stock_sentiment
Is Tata Motors stock showing bullish signs?,stock_sentiment
Is Bharat Electronics stock sentiment favorable?,stock_sentiment
What is the sentiment of Amazon stock?,stock_sentiment
What’s the general market sentiment on Vedanta stock?,stock_sentiment
Are Apple shares favored in today’s market?,stock_sentiment
Tell me if TCS shares are favored by investors.,stock_sentiment
Give me sentiment analysis for Tech Mahindra stock.,stock_sentiment
How is the sentiment on NTPC stock evolving?,stock_sentiment
Are LIC shares viewed positively right now?,stock_sentiment
What’s the investor sentiment for TCS today?,stock_sentiment
Give me sentiment analysis for ICICI Bank stock.,stock_sentiment
How is the market sentiment for Dell stocks?,stock_sentiment
How is the sentiment on Apple stock evolving?,stock_sentiment
How is the market sentiment for Infosys stocks?,stock_sentiment
Tell me if Ashok Leyland is going up or down.,stock_sentiment
What is the sentiment of Bharti Airtel stock?,stock_sentiment
Is SBI stock bullish or bearish?,stock_sentiment
Is Bharti Airtel stock trending positively?,stock_sentiment
Analyze the stock sentiment for Microsoft.,stock_sentiment
Are Netflix shares seeing increased investor confidence?,stock_sentiment
Are Google shares favored in today’s market?,stock_sentiment
Check if ITC stock is receiving positive feedback.,stock_sentiment
How is the market sentiment for Asian Paints stocks?,stock_sentiment
Check the sentiment for Tata Motors stock.,stock_sentiment
What’s the public opinion on Paytm stock?,stock_sentiment
Is Infosys stock trending positively?,stock_sentiment
Check the public sentiment for Britannia stock.,stock_sentiment
Is Apple stock sentiment favorable?,stock_sentiment
Is Apple stock showing positive signs?,stock_sentiment
Check if LIC stock is receiving positive feedback.,stock_sentiment
Give me sentiment analysis for Reliance Industries stock.,stock_sentiment
Are Nvidia shares seeing positive sentiment?,stock_sentiment
Are traders optimistic about Tech Mahindra stock?,stock_sentiment
Analyze the stock sentiment for Tata Motors.,stock_sentiment
Is Flipkart stock showing bullish signs?,stock_sentiment
How do investors feel about NTPC stock recently?,stock_sentiment
Are Netflix shares seeing positive sentiment?,stock_sentiment
What is the sentiment of Amazon stock?,stock_sentiment
Are Meta shares trending bullish currently?,stock_sentiment
Is the Bharat Electronics stock sentiment bullish or bearish?,stock_sentiment
What’s the public sentiment for Ashok Leyland shares?,stock_sentiment
Is Nvidia stock trending positively?,stock_sentiment
Check the sentiment for Dell shares today.,stock_sentiment
Is the Axis Bank stock sentiment bullish or bearish?,stock_sentiment
How are people reacting to Britannia shares?,stock_sentiment
Analyze Dell’s stock sentiment from recent news.,stock_sentiment
What’s the mood around Twitter stock today?,stock_sentiment
What is the sentiment of Tesla stock?,stock_sentiment
How do investors feel about Uber stock recently?,stock_sentiment
What’s the investor sentiment for Apple today?,stock_sentiment
How are ICICI Bank shares perceived by traders?,stock_sentiment
What is the sentiment of Microsoft stock?,stock_sentiment
Are Apple shares viewed positively right now?,stock_sentiment
Is the HDFC Bank stock sentiment bullish or bearish?,stock_sentiment
Give me the current sentiment for Asian Paints shares.,stock_sentiment
How is the sentiment on Netflix shares?,stock_sentiment
Is the JSW Steel stock sentiment bullish or bearish?,stock_sentiment
Is Britannia stock showing positive signs?,stock_sentiment
Analyze Tata Motors’s stock sentiment from recent news.,stock_sentiment
What’s the general market sentiment on Tata Motors stock?,stock_sentiment
Check if Wipro stock is receiving positive feedback.,stock_sentiment
How is the sentiment on Tata Elxsi shares?,stock_sentiment
Check if Tata Elxsi stock is receiving positive feedback.,stock_sentiment
Check the public sentiment for Google stock.,stock_sentiment
Check the sentiment for HDFC Bank stock.,stock_sentiment
What’s the investor mood around Tata Motors stock?,stock_sentiment
How is Zomato stock sentiment trending?,stock_sentiment
What’s the investor mood around Bharat Electronics stock?,stock_sentiment
Is Bajaj Finance stock sentiment favorable?,stock_sentiment
Are Apple shares favored in today’s market?,stock_sentiment
Are traders optimistic about Ashok Leyland stock?,stock_sentiment
Analyze Netflix’s stock sentiment from recent news.,stock_sentiment
Analyze Meta stock sentiment from social media.,stock_sentiment
Is Wipro stock sentiment favorable?,stock_sentiment
Check the sentiment for BYJU’s shares today.,stock_sentiment
What’s the mood around Dell stock today?,stock_sentiment
Tell me if HUL shares have a positive outlook.,stock_sentiment
What’s the public sentiment for ICICI Bank shares?,stock_sentiment
Give me sentiment analysis for Nvidia stock.,stock_sentiment
What’s the investor sentiment on Tech Mahindra stock?,stock_sentiment
Analyze the stock sentiment for HDFC Bank.,stock_sentiment
Check the sentiment for BYJU’s shares today.,stock_sentiment
Give me sentiment analysis for HUL stock.,stock_sentiment
How is the sentiment on Bajaj Finance shares?,stock_sentiment
Check the sentiment for ITC shares today.,stock_sentiment
Is Axis Bank stock viewed as bullish currently?,stock_sentiment
Tell me if Asian Paints stock is trending up.,stock_sentiment
Are LIC shares trending bullish currently?,stock_sentiment
Check the public sentiment for Reliance Industries stock.,stock_sentiment
Are Asian Paints shares favored in today’s market?,stock_sentiment
How is Reliance Industries stock sentiment trending?,stock_sentiment
Are investors positive or negative on ICICI Bank stock?,stock_sentiment
Is the Maruti Suzuki stock sentiment bullish or bearish?,stock_sentiment
Is Facebook stock getting good reviews from traders?,stock_sentiment
Is Adani Enterprises stock viewed as bullish currently?,stock_sentiment
What’s the investor sentiment for Google today?,stock_sentiment
What’s the public sentiment for Britannia shares?,stock_sentiment
How is the sentiment on Bajaj Finance stock evolving?,stock_sentiment
Check the sentiment for Bharti Airtel stock.,stock_sentiment
Is Tata Motors stock viewed as bullish currently?,stock_sentiment
Are investors positive or negative on Paytm stock?,stock_sentiment
What’s the mood around NTPC stock today?,stock_sentiment
Are Amazon shares seeing increased investor confidence?,stock_sentiment
Are Tata Elxsi shares viewed positively right now?,stock_sentiment
How is the market sentiment for Britannia stocks?,stock_sentiment
How are Microsoft shares perceived by traders?,stock_sentiment
Is Marico stock getting good reviews from traders?,stock_sentiment
Is Facebook stock getting good reviews from traders?,stock_sentiment
Check if Microsoft stock is receiving positive feedback.,stock_sentiment
How are ITC shares perceived by traders?,stock_sentiment
What is the sentiment of LIC stock?,stock_sentiment
How are people reacting to HDFC Bank shares?,stock_sentiment
Is Tata Motors stock viewed as bullish currently?,stock_sentiment
Check the public sentiment for JSW Steel stock.,stock_sentiment
Is Meta stock showing bullish signs?,stock_sentiment
Are investors confident in Google shares?,stock_sentiment
Analyze Tech Mahindra’s stock sentiment from recent news.,stock_sentiment
How is the market sentiment for HDFC Bank stocks?,stock_sentiment
How are Uber shares perceived by traders?,stock_sentiment
Is Uber stock getting good reviews from traders?,stock_sentiment
How is the sentiment on Reliance Industries stock evolving?,stock_sentiment
Tell me if Wipro is going up or down.,stock_sentiment
Check the sentiment for Facebook shares today.,stock_sentiment
What’s the investor sentiment for Bajaj Finance today?,stock_sentiment
How are Apple shares perceived by traders?,stock_sentiment
Give me sentiment analysis for Bharti Airtel stock.,stock_sentiment
How do investors feel about Infosys stock recently?,stock_sentiment
Is Flipkart stock sentiment favorable?,stock_sentiment
Are Zomato shares viewed positively right now?,stock_sentiment
Analyze Britannia’s stock sentiment from recent news.,stock_sentiment
Check the public sentiment for Britannia stock.,stock_sentiment
Are investors positive or negative on NTPC stock?,stock_sentiment
Is Dell stock getting good reviews from traders?,stock_sentiment
How are people reacting to Tesla shares?,stock_sentiment
How is the sentiment on Flipkart shares?,stock_sentiment
Is Wipro stock sentiment favorable?,stock_sentiment
Are Facebook shares seeing increased investor confidence?,stock_sentiment
How is the market feeling about JSW Steel?,stock_sentiment
What’s the investor sentiment for Twitter today?,stock_sentiment
Are traders optimistic about Nvidia stock?,stock_sentiment
Check the sentiment for Amazon stock.,stock_sentiment
Tell me if BYJU’s shares have a positive outlook.,stock_sentiment
Check the sentiment for Tech Mahindra shares today.,stock_sentiment
Check the sentiment for JSW Steel shares today.,stock_sentiment
How is the market feeling about ITC?,stock_sentiment
Is Wipro stock getting good reviews from traders?,stock_sentiment
What’s the public sentiment for Tata Elxsi shares?,stock_sentiment
Check the sentiment for Wipro stock.,stock_sentiment
How is the market sentiment for Paytm stocks?,stock_sentiment
Tell me if Reliance Industries is going up or down.,stock_sentiment
Check the sentiment for Facebook shares today.,stock_sentiment
Is Meta stock bullish or bearish?,stock_sentiment
Is Flipkart stock showing bullish signs?,stock_sentiment
Are Bharti Airtel shares in a bullish mood?,stock_sentiment
Check the sentiment for Maruti Suzuki shares today.,stock_sentiment
Are Zomato shares in a bullish mood?,stock_sentiment
How do investors feel about ICICI Bank stock recently?,stock_sentiment
Analyze the stock sentiment for Britannia.,stock_sentiment
Check the public sentiment for Flipkart stock.,stock_sentiment
How is the market sentiment for Netflix stocks?,stock_sentiment
Check the sentiment for Dell stock.,stock_sentiment
How is Bharti Airtel stock sentiment trending?,stock_sentiment
What’s the investor sentiment on Meta stock?,stock_sentiment
Is Tech Mahindra stock viewed as bullish currently?,stock_sentiment
Tell me if Paytm shares have a positive outlook.,stock_sentiment
Is ITC stock sentiment favorable?,stock_sentiment
Is Ashok Leyland stock getting good reviews from traders?,stock_sentiment
How is the sentiment on ONGC shares?,stock_sentiment
Tell me if Google shares are favored by investors.,stock_sentiment
Are Tata Steel shares seeing positive sentiment?,stock_sentiment
Are investors confident in TCS shares?,stock_sentiment
What’s the mood around Twitter stock today?,stock_sentiment
What’s the investor sentiment for HDFC Bank today?,stock_sentiment
How is the market sentiment for Nvidia stocks?,stock_sentiment
How is the sentiment on Bharat Electronics stock evolving?,stock_sentiment
Give me sentiment analysis for TCS stock.,stock_sentiment
What’s the general market sentiment on Microsoft stock?,stock_sentiment
What’s the public sentiment for Flipkart shares?,stock_sentiment
What’s the general market sentiment on Microsoft stock?,stock_sentiment
Are Wipro shares in a bullish mood?,stock_sentiment
Tell me if ONGC stock is trending up.,stock_sentiment
Is Paytm stock trending positively?,stock_sentiment
What is the sentiment of SBI stock?,stock_sentiment
What is the sentiment of Adani Enterprises stock?,stock_sentiment
Check the sentiment for Tata Steel stock.,stock_sentiment
Tell me if Nvidia stock is trending up.,stock_sentiment
Tell me if Britannia shares have a positive outlook.,stock_sentiment
Are traders optimistic about TCS stock?,stock_sentiment
Give me sentiment analysis for Ashok Leyland stock.,stock_sentiment
Is Flipkart stock showing positive signs?,stock_sentiment
How is Britannia stock sentiment trending?,stock_sentiment
Are Bharti Airtel shares favored in today’s market?,stock_sentiment
Tell me if Bajaj Finance is going up or down.,stock_sentiment
What’s the general market sentiment on Infosys stock?,stock_sentiment
Is Tata Motors stock bullish or bearish?,stock_sentiment
Are Paytm shares seeing positive sentiment?,stock_sentiment
Check the sentiment for Tata Motors stock.,stock_sentiment
What’s the mood around Netflix stock today?,stock_sentiment
Tell me if Britannia stock is trending up.,stock_sentiment
Is Infosys stock sentiment favorable?,stock_sentiment
Tell me if Nvidia is going up or down.,stock_sentiment
Check the sentiment for Zomato shares today.,stock_sentiment
What’s the investor sentiment on Apple stock?,stock_sentiment
What’s the general market sentiment on Google stock?,stock_sentiment
What’s the public opinion on Tech Mahindra stock?,stock_sentiment
Are Marico shares in a bullish mood?,stock_sentiment
What’s the public sentiment for JSW Steel shares?,stock_sentiment
What’s the investor mood around Paytm stock?,stock_sentiment
What’s the public opinion on ONGC stock?,stock_sentiment
Are investors confident in LIC shares?,stock_sentiment
What’s the public sentiment for Amazon shares?,stock_sentiment
Is the ONGC stock sentiment bullish or bearish?,stock_sentiment
How is the market feeling about Netflix?,stock_sentiment
Tell me if Adani Enterprises stock is trending up.,stock_sentiment
Is the Paytm stock sentiment bullish or bearish?,stock_sentiment
Is Apple stock showing positive signs?,stock_sentiment
What’s the investor mood around Nvidia stock?,stock_sentiment
Is Ashok Leyland stock sentiment favorable?,stock_sentiment
How is the sentiment on Bajaj Finance shares?,stock_sentiment
Check the sentiment for ITC shares today.,stock_sentiment
Are Bharti Airtel shares trending bullish currently?,stock_sentiment
Is Asian Paints stock showing bullish signs?,stock_sentiment
How is the sentiment on Zomato stock evolving?,stock_sentiment
How is the market sentiment for ICICI Bank stocks?,stock_sentiment
Check if Bharat Electronics stock is receiving positive feedback.,stock_sentiment
Are Uber shares in a bullish mood?,stock_sentiment
Analyze SBI stock sentiment from social media.,stock_sentiment
Analyze SBI stock sentiment from social media.,stock_sentiment
How is the sentiment on Dell stock evolving?,stock_sentiment
Are Tata Steel shares in a bullish mood?,stock_sentiment
How is the sentiment on Tata Elxsi stock evolving?,stock_sentiment
What’s the investor sentiment for Tech Mahindra today?,stock_sentiment
Is Facebook stock sentiment positive or negative?,stock_sentiment
Tell me if ITC shares are favored by investors.,stock_sentiment
Is JSW Steel stock showing bullish signs?,stock_sentiment
Tell me if Microsoft is going up or down.,stock_sentiment
How is the sentiment on BYJU’s stock evolving?,stock_sentiment
Are Vedanta shares seeing increased investor confidence?,stock_sentiment
Are traders optimistic about Twitter stock?,stock_sentiment
Is Wipro stock sentiment positive or negative?,stock_sentiment
Analyze Tesla stock sentiment from social media.,stock_sentiment
Is Bajaj Finance stock showing bullish signs?,stock_sentiment
Analyze Tech Mahindra’s stock sentiment from recent news.,stock_sentiment
Are investors positive or negative on Wipro stock?,stock_sentiment
Analyze Marico stock sentiment from social media.,stock_sentiment
Give me sentiment analysis for LIC stock.,stock_sentiment
Are Google shares seeing positive sentiment?,stock_sentiment
Analyze the stock sentiment for Flipkart.,stock_sentiment
How is the sentiment on Axis Bank shares?,stock_sentiment
How is the sentiment on ONGC stock evolving?,stock_sentiment
Are Adani Enterprises shares trending bullish currently?,stock_sentiment
How is the sentiment on Bajaj Finance stock evolving?,stock_sentiment
Are investors positive or negative on ONGC stock?,stock_sentiment
How are people reacting to Bajaj Finance shares?,stock_sentiment
What’s the investor mood around Reliance Industries stock?,stock_sentiment
How is the market feeling about BYJU’s?,stock_sentiment
Tell me if TCS stock is trending up.,stock_sentiment
Are Google shares favored in today’s market?,stock_sentiment
Tell me if TCS shares are favored by investors.,stock_sentiment
Are traders optimistic about Tech Mahindra stock?,stock_sentiment
Is Facebook stock getting good reviews from traders?,stock_sentiment
Analyze the stock sentiment for Adani Enterprises.,stock_sentiment
What’s the mood around Twitter stock today?,stock_sentiment
What’s the investor sentiment for Tata Steel today?,stock_sentiment
What’s the public opinion on Dell stock?,stock_sentiment
Analyze Bharti Airtel’s stock sentiment from recent news.,stock_sentiment
