text,intent
Tell me the current sentiment on Tata Consultancy Services stock,stock_sentiment
What is the market mood for Bharti Airtel shares?,stock_sentiment
Is the sentiment favorable for Larsen & Toubro stock?,stock_sentiment
How is the investor sentiment on Facebook stock?,stock_sentiment
Check if Apple stock has bullish sentiment today,stock_sentiment
Are traders optimistic about Nestle India shares?,stock_sentiment
What is the sentiment trend for State Bank of India stock?,stock_sentiment
Tell me if Wipro stock is viewed positively by investors,stock_sentiment
How do investors feel about Boeing stock?,stock_sentiment
Is the market mood optimistic for Johnson & Johnson shares?,stock_sentiment
Analyze the sentiment for Tata Motors stock,stock_sentiment
Are investors bullish on Mahindra & Mahindra stock?,stock_sentiment
What’s the current investor sentiment on Netflix shares?,stock_sentiment
How is the sentiment on Pfizer stock?,stock_sentiment
Tell me if ICICI Prudential Life shares have positive sentiment,stock_sentiment
Check the sentiment for Uber Technologies stock,stock_sentiment
Is the investor mood positive for Asian Paints shares?,stock_sentiment
What’s the market sentiment for Tata Chemicals stock?,stock_sentiment
Are traders optimistic about Reliance Power stock?,stock_sentiment
How do investors feel about Cisco Systems shares?,stock_sentiment
Tell me the sentiment on Johnson Controls stock,stock_sentiment
Is the market mood bullish for Bajaj Auto shares?,stock_sentiment
Analyze the investor sentiment for Ford Motor Company stock,stock_sentiment
Are investors confident about Oil and Natural Gas Corporation shares?,stock_sentiment
What’s the sentiment trend for Britannia Industries stock?,stock_sentiment
Tell me if Tesla stock is viewed positively by traders,stock_sentiment
How is the sentiment on HDFC Life shares?,stock_sentiment
Check the current investor sentiment on Maruti Suzuki stock,stock_sentiment
Are investors bullish on Tata Power stock?,stock_sentiment
What’s the sentiment for Infosys shares?,stock_sentiment
Tell me if Facebook stock has positive sentiment now,stock_sentiment
How do traders feel about Bajaj Finance stock?,stock_sentiment
Is the investor mood favorable for ICICI Bank shares?,stock_sentiment
What is the sentiment on Nestle India stock?,stock_sentiment
Are traders optimistic about Larsen & Toubro Infotech stock?,stock_sentiment
Tell me if Amazon stock is bullish or bearish,stock_sentiment
How is the market feeling about Qualcomm shares?,stock_sentiment
What’s the investor sentiment on Tata Steel shares?,stock_sentiment
Are investors confident about Bharti Airtel shares?,stock_sentiment
Analyze the sentiment for Microsoft stock,stock_sentiment
Is the market mood positive for Apple Inc stock?,stock_sentiment
Tell me if Wipro stock is bullish or bearish today,stock_sentiment
How do investors feel about Tata Consultancy Services shares?,stock_sentiment
What’s the sentiment for Mahindra & Mahindra stock?,stock_sentiment
Are traders optimistic about Netflix stock?,stock_sentiment
Check the sentiment on ICICI Prudential Life stock,stock_sentiment
Tell me if Tesla stock has bullish sentiment,stock_sentiment
How is the market sentiment on Reliance Industries stock?,stock_sentiment
What’s the investor mood on Bajaj Auto shares?,stock_sentiment
Are investors confident about Larsen & Toubro stock?,stock_sentiment
Tell me if Facebook stock is viewed positively,stock_sentiment
How do traders feel about Uber stock?,stock_sentiment
Is the market sentiment favorable for Tata Motors stock?,stock_sentiment
Analyze the investor sentiment on Johnson & Johnson shares,stock_sentiment
What’s the sentiment trend for Infosys shares?,stock_sentiment
Are investors bullish on Apple stock today?,stock_sentiment
Tell me if Bajaj Finance stock has positive sentiment,stock_sentiment
How is the sentiment on HDFC Bank stock?,stock_sentiment
What’s the investor sentiment on Nestle India shares?,stock_sentiment
Are traders optimistic about State Bank of India stock?,stock_sentiment
Check if Amazon stock is bullish or bearish,stock_sentiment
Tell me the current sentiment on Microsoft shares,stock_sentiment
What’s the sentiment on Maruti Suzuki stock?,stock_sentiment
Are traders bullish on Tata Steel shares?,stock_sentiment
Analyze investor mood for Reliance Industries today,stock_sentiment
Is the market sentiment positive for Infosys stock?,stock_sentiment
Tell me if Tesla shares have bullish sentiment now,stock_sentiment
How do investors feel about ICICI Bank stock today?,stock_sentiment
Check if Amazon stock is being viewed positively,stock_sentiment
What’s the sentiment trend for Asian Paints shares?,stock_sentiment
Are traders optimistic about HDFC Bank shares?,stock_sentiment
Tell me if Microsoft stock is gaining positive sentiment,stock_sentiment
How is the investor mood on Bharti Airtel stock?,stock_sentiment
Is the market sentiment bullish for Tata Motors shares?,stock_sentiment
Analyze current sentiment for Facebook stock,stock_sentiment
Are investors confident about Bajaj Finance stock?,stock_sentiment
Tell me if Wipro stock sentiment is positive today,stock_sentiment
What’s the investor mood for Netflix shares?,stock_sentiment
How do traders feel about Larsen & Toubro stock?,stock_sentiment
Check the sentiment for Johnson & Johnson stock,stock_sentiment
Is the market optimistic about Tata Power shares?,stock_sentiment
Tell me if Uber stock is experiencing bullish sentiment,stock_sentiment
What’s the sentiment on Pfizer stock today?,stock_sentiment
Are investors positive about ICICI Prudential Life shares?,stock_sentiment
How is the market feeling about Ford Motor Company stock?,stock_sentiment
Tell me if Sony stock has positive investor sentiment,stock_sentiment
Check if Apple stock is showing bullish signals,stock_sentiment
What’s the sentiment on Tata Chemicals shares?,stock_sentiment
Are traders optimistic about Reliance Power stock?,stock_sentiment
Analyze the sentiment for Boeing stock,stock_sentiment
How do investors feel about Cisco Systems shares?,stock_sentiment
Is the market mood positive for Bajaj Auto stock?,stock_sentiment
Tell me the current sentiment on Britannia Industries stock,stock_sentiment
Are traders bullish on Tata Consultancy Services shares?,stock_sentiment
What’s the investor sentiment on State Bank of India stock?,stock_sentiment
Check if Amazon shares have positive sentiment,stock_sentiment
How do investors feel about Facebook stock today?,stock_sentiment
Is the market optimistic about Maruti Suzuki shares?,stock_sentiment
Tell me if Tesla stock is showing bearish signs,stock_sentiment
Analyze current investor sentiment for ICICI Bank shares,stock_sentiment
What’s the sentiment trend for Infosys stock?,stock_sentiment
Are traders bullish on Larsen & Toubro Infotech shares?,stock_sentiment
Tell me if Microsoft shares are viewed positively,stock_sentiment
How do investors feel about Bajaj Finance stock?,stock_sentiment
Is the market mood favorable for Tata Motors stock?,stock_sentiment
Check the investor sentiment on Netflix shares,stock_sentiment
What’s the market feeling about ICICI Prudential Life stock?,stock_sentiment
Are traders optimistic about Apple stock?,stock_sentiment
Tell me if Reliance Industries stock sentiment is bullish,stock_sentiment
How do investors feel about Bajaj Auto stock today?,stock_sentiment
Is the market positive about Tata Steel shares?,stock_sentiment
Check if Amazon stock is showing bullish momentum,stock_sentiment
Tell me the current investor mood for Microsoft shares,stock_sentiment
Are investors confident about HDFC Life stock?,stock_sentiment
What’s the sentiment on Bharti Airtel shares today?,stock_sentiment
Analyze the market sentiment for Larsen & Toubro stock,stock_sentiment
Is the investor mood positive for Tesla stock?,stock_sentiment
How do traders feel about Tata Consultancy Services shares?,stock_sentiment
Tell me if Apple stock is showing positive sentiment,stock_sentiment
Are investors bullish on Netflix stock?,stock_sentiment
What’s the sentiment trend for Facebook shares?,stock_sentiment
Check if ICICI Bank shares are viewed positively,stock_sentiment
How is the market mood about Infosys stock?,stock_sentiment
Tell me if Tata Power stock has bullish sentiment,stock_sentiment
Are traders optimistic about Amazon stock today?,stock_sentiment
What’s the sentiment on HCL Technologies stock?,stock_sentiment
Are investors bullish about Mahindra & Mahindra shares?,stock_sentiment
Analyze market mood for Paytm stock,stock_sentiment
Is the sentiment positive for Google stock today?,stock_sentiment
Tell me if Wipro shares are gaining bullish momentum,stock_sentiment
How do traders feel about SBI Life stock?,stock_sentiment
Is Tesla stock being viewed negatively?,stock_sentiment
What’s the current investor sentiment for UltraTech Cement?,stock_sentiment
Are traders optimistic about IBM shares?,stock_sentiment
Tell me if Tata Consumer Products stock is bullish,stock_sentiment
Check the sentiment for Adobe stock,stock_sentiment
How is the market feeling about Kotak Mahindra Bank shares?,stock_sentiment
What’s the investor mood for Netflix stock?,stock_sentiment
Are investors positive about Maruti Suzuki shares?,stock_sentiment
Tell me if Apple stock is showing bearish sentiment,stock_sentiment
Analyze the sentiment for Asian Paints shares,stock_sentiment
Is the market optimistic about HDFC Bank stock?,stock_sentiment
How do traders feel about Tesla shares today?,stock_sentiment
Check if Infosys stock is trending bullish,stock_sentiment
Tell me the current investor mood for ICICI Bank stock,stock_sentiment
Are traders bullish on Reliance Industries shares?,stock_sentiment
What’s the sentiment on Tata Steel stock?,stock_sentiment
How is the market feeling about Facebook shares?,stock_sentiment
Is the sentiment positive for Microsoft stock?,stock_sentiment
Tell me if Amazon stock is bullish or bearish,stock_sentiment
Are investors confident about Larsen & Toubro shares?,stock_sentiment
Check the market mood for Sony stock,stock_sentiment
How do traders feel about Bharat Petroleum stock?,stock_sentiment
What’s the investor sentiment on Tata Power shares?,stock_sentiment
Are investors optimistic about Zoom Video stock?,stock_sentiment
Tell me if Boeing stock is showing bullish trends,stock_sentiment
How is the market mood for Bajaj Finance stock?,stock_sentiment
Are traders bullish on HDFC Life shares?,stock_sentiment
What’s the sentiment trend for ICICI Prudential Life stock?,stock_sentiment
Tell me if Uber stock has positive investor sentiment,stock_sentiment
How do investors feel about Tata Consultancy Services stock?,stock_sentiment
Check if Reliance Power shares are gaining bullish momentum,stock_sentiment
Are traders optimistic about Pfizer stock?,stock_sentiment
What’s the investor mood for Bajaj Auto shares?,stock_sentiment
Tell me if Adobe shares are trending bullish,stock_sentiment
How is the market sentiment for Mahindra Electric stock?,stock_sentiment
Are investors positive about Facebook stock?,stock_sentiment
Check the sentiment on Tata Chemicals shares,stock_sentiment
What’s the market feeling about Infosys stock today?,stock_sentiment
Tell me if ICICI Bank shares are showing bearish signs,stock_sentiment
Are traders bullish on Maruti Suzuki stock?,stock_sentiment
How do investors feel about Google stock?,stock_sentiment
What’s the sentiment on Wipro stock?,stock_sentiment
Tell me if Tesla shares are gaining positive sentiment,stock_sentiment
Are traders optimistic about Reliance Industries stock?,stock_sentiment
How is the market mood for Amazon stock?,stock_sentiment
Check if Microsoft stock is trending bullish,stock_sentiment
Tell me the investor sentiment for Larsen & Toubro stock,stock_sentiment
Are investors confident about Bajaj Finance shares?,stock_sentiment
What’s the sentiment trend for Tata Motors stock?,stock_sentiment
How do traders feel about Netflix stock?,stock_sentiment
Tell me if ICICI Prudential Life stock is bullish,stock_sentiment
Are investors positive about Apple stock?,stock_sentiment
What’s the market feeling about Bajaj Auto stock?,stock_sentiment
Check if Amazon shares are gaining bullish momentum,stock_sentiment
How do investors feel about Tata Steel stock?,stock_sentiment
What is the current sentiment for Axis Bank stock?,stock_sentiment
Are investors bullish on HDFC shares today?,stock_sentiment
Analyze the market sentiment for ITC stock,stock_sentiment
How is the investor mood for Infosys stock?,stock_sentiment
Is the sentiment positive for Reliance Industries stock?,stock_sentiment
Tell me if Tata Steel shares are bullish or bearish,stock_sentiment
What do traders think about Wipro stock?,stock_sentiment
How do investors feel about Adani Enterprises shares?,stock_sentiment
Are the market sentiments favorable for Bharti Airtel stock?,stock_sentiment
Is there bullish momentum in Asian Paints shares?,stock_sentiment
Check the current investor sentiment on Google stock,stock_sentiment
Is Tesla stock showing signs of bearish trend?,stock_sentiment
How is the market sentiment for Nestle India stock?,stock_sentiment
Tell me if Amazon shares are gaining positive investor sentiment,stock_sentiment
What’s the sentiment around Maruti Suzuki stock?,stock_sentiment
Are traders optimistic about Bajaj Finance stock?,stock_sentiment
Analyze the stock sentiment for Pfizer shares,stock_sentiment
Is the market mood bullish for ICICI Bank stock?,stock_sentiment
Tell me if Netflix stock is seeing positive investor interest,stock_sentiment
What is the sentiment for UltraTech Cement shares?,stock_sentiment
Are investors positive about Microsoft stock?,stock_sentiment
How do traders feel about Sony stock today?,stock_sentiment
What’s the investor sentiment for Tata Motors shares?,stock_sentiment
Check if Reliance Power stock is bullish or bearish,stock_sentiment
How is the market feeling about HDFC Life stock?,stock_sentiment
Are the investors optimistic about Bharat Petroleum shares?,stock_sentiment
Tell me if Uber stock is showing bullish trends,stock_sentiment
What’s the sentiment for Bajaj Auto stock today?,stock_sentiment
How do investors feel about Infosys shares?,stock_sentiment
Are traders confident about Larsen & Toubro stock?,stock_sentiment
Is Amazon stock being viewed positively by the market?,stock_sentiment
What is the current mood for Axis Bank shares?,stock_sentiment
Tell me if HCL Technologies stock is bullish,stock_sentiment
How’s the market sentiment on Tata Consumer Products stock?,stock_sentiment
Are investors positive about ICICI Prudential Life shares?,stock_sentiment
Is the stock sentiment bullish for Adani Ports and SEZ?,stock_sentiment
What’s the current investor mood for Paytm stock?,stock_sentiment
Check the sentiment trend for Bajaj Finance shares,stock_sentiment
Are traders optimistic about Google stock?,stock_sentiment
How do investors feel about Facebook shares?,stock_sentiment
What’s the market sentiment on Mahindra & Mahindra stock?,stock_sentiment
Tell me if ICICI Bank shares are trending bullish,stock_sentiment
Are investors confident about Tata Power stock?,stock_sentiment
How is the sentiment for Nestle India shares?,stock_sentiment
What’s the sentiment around Sony stock today?,stock_sentiment
Are traders positive about Bajaj Auto shares?,stock_sentiment
Check if Maruti Suzuki stock has bullish momentum,stock_sentiment
What do investors think about Pfizer shares?,stock_sentiment
Is Tesla stock being perceived negatively?,stock_sentiment
How is the market feeling about UltraTech Cement shares?,stock_sentiment
Are traders optimistic about Adobe stock?,stock_sentiment
What’s the investor sentiment on Wipro shares?,stock_sentiment
Tell me if Amazon stock is bullish or bearish today,stock_sentiment
Are investors positive about Tata Steel stock?,stock_sentiment
How do traders feel about HDFC Bank stock?,stock_sentiment
What’s the market sentiment for Reliance Industries shares?,stock_sentiment
Is ICICI Prudential Life stock trending bullish?,stock_sentiment
Tell me if Facebook stock is being viewed positively,stock_sentiment
Are investors confident about Bajaj Finance shares?,stock_sentiment
What is the investor sentiment for Sun Pharma stock?,stock_sentiment
Is Tesla stock gaining bullish momentum?,stock_sentiment
How do traders view HDFC Bank shares?,stock_sentiment
Are investors optimistic about Reliance Industries today?,stock_sentiment
Analyze market mood for Google stock,stock_sentiment
Is Infosys stock showing signs of positive sentiment?,stock_sentiment
What’s the sentiment around Tata Motors shares?,stock_sentiment
Are traders bearish on Amazon stock?,stock_sentiment
Tell me if Bajaj Finance shares are bullish,stock_sentiment
How is the market sentiment for Adani Enterprises?,stock_sentiment
Is Microsoft stock viewed positively by investors?,stock_sentiment
What do investors think about ICICI Bank shares?,stock_sentiment
Are investors bullish on Bharti Airtel stock?,stock_sentiment
How is the sentiment for Maruti Suzuki shares?,stock_sentiment
Tell me if Facebook stock is trending up,stock_sentiment
Are traders positive on Wipro stock?,stock_sentiment
What is the sentiment for Larsen & Toubro shares?,stock_sentiment
How do investors feel about Tata Steel stock?,stock_sentiment
Is the market mood bearish for Netflix stock?,stock_sentiment
What’s the sentiment trend for Bajaj Auto shares?,stock_sentiment
Are investors confident about Uber stock?,stock_sentiment
Tell me if UltraTech Cement shares are seeing positive sentiment,stock_sentiment
What’s the current investor mood on ICICI Prudential Life?,stock_sentiment
Are traders optimistic about Paytm stock?,stock_sentiment
How do investors feel about Sony shares?,stock_sentiment
Is the stock sentiment bullish for HCL Technologies?,stock_sentiment
Check if Tata Consumer Products stock is favored by investors,stock_sentiment
Are investors positive on Bajaj Finance stock?,stock_sentiment
What’s the sentiment for Nestle India shares?,stock_sentiment
How do traders view Mahindra & Mahindra stock?,stock_sentiment
Tell me if ICICI Bank shares are bullish or bearish,stock_sentiment
Are investors confident about Tata Power stock?,stock_sentiment
What’s the investor sentiment on Google shares?,stock_sentiment
Is Amazon stock showing bullish signals?,stock_sentiment
How is the market feeling about Axis Bank stock?,stock_sentiment
Are traders optimistic about HDFC Life shares?,stock_sentiment
What is the sentiment for Reliance Power stock?,stock_sentiment
Tell me if Bajaj Auto shares are favored by investors,stock_sentiment
Are investors positive about Pfizer stock?,stock_sentiment
What’s the market mood on Netflix shares?,stock_sentiment
Is Tesla stock viewed negatively?,stock_sentiment
How do investors feel about Adobe stock?,stock_sentiment
Are traders bullish on Facebook stock?,stock_sentiment
Tell me if HDFC Bank stock is gaining positive sentiment,stock_sentiment
What is the investor sentiment on Tata Steel shares?,stock_sentiment
Are traders optimistic about Infosys stock?,stock_sentiment
How do investors view Maruti Suzuki shares?,stock_sentiment
Is ICICI Prudential Life stock showing signs of bullish momentum?,stock_sentiment
What’s the current sentiment for Reliance Industries stock?,stock_sentiment
Are investors confident about Wipro shares?,stock_sentiment
Tell me if Amazon stock is trending positive,stock_sentiment
What is the sentiment around Bharti Airtel stock?,stock_sentiment
Are traders bullish on Tata Motors stock?,stock_sentiment
How is the market mood for Uber shares?,stock_sentiment
Are investors optimistic about Nestle India stock?,stock_sentiment
Is Adani Enterprises stock bullish or bearish?,stock_sentiment
Are investors positive or negative on ICICI Bank stock?,stock_sentiment
Tell me if Tata Motors shares have a positive outlook.,stock_sentiment
Is ITC stock trending positively?,stock_sentiment
Are investors positive or negative on Tech Mahindra stock?,stock_sentiment
Are traders optimistic about Twitter stock?,stock_sentiment
How are people reacting to Apple shares?,stock_sentiment
How is the market sentiment for Bajaj Finance stocks?,stock_sentiment
Analyze the stock sentiment for Microsoft.,stock_sentiment
What’s the investor sentiment for SBI today?,stock_sentiment
What is the sentiment of Tech Mahindra stock?,stock_sentiment
How is Adani Enterprises stock sentiment trending?,stock_sentiment
Is HDFC Bank stock trending positively?,stock_sentiment
Are Paytm shares viewed positively right now?,stock_sentiment
Tell me if Amazon stock is trending up.,stock_sentiment
How is the market sentiment for SBI stocks?,stock_sentiment
How is the sentiment on Zomato shares?,stock_sentiment
Is Infosys stock viewed as bullish currently?,stock_sentiment
Are Tata Steel shares seeing increased investor confidence?,stock_sentiment
Are JSW Steel shares seeing positive sentiment?,stock_sentiment
How are people reacting to Apple shares?,stock_sentiment
Is ITC stock showing bullish signs?,stock_sentiment
Is Adani Enterprises stock showing bullish signs?,stock_sentiment
Are Wipro shares in a bullish mood?,stock_sentiment
Analyze the stock sentiment for Flipkart.,stock_sentiment
How is Twitter stock sentiment trending?,stock_sentiment
Is JSW Steel stock bullish or bearish?,stock_sentiment
Check the public sentiment for Bharti Airtel stock.,stock_sentiment
Is Dell stock getting good reviews from traders?,stock_sentiment
What is the sentiment of Tesla stock?,stock_sentiment
Tell me if ITC shares have a positive outlook.,stock_sentiment
How are people reacting to Tesla shares?,stock_sentiment
Check the public sentiment for HUL stock.,stock_sentiment
Are traders optimistic about LIC stock?,stock_sentiment
What’s the public sentiment for Flipkart shares?,stock_sentiment
Is Wipro stock showing bullish signs?,stock_sentiment
Is Bharti Airtel stock bullish or bearish?,stock_sentiment
What is the sentiment of JSW Steel stock?,stock_sentiment
Analyze Tata Motors stock sentiment from social media.,stock_sentiment
How is Dell stock sentiment trending?,stock_sentiment
Are investors confident in Wipro shares?,stock_sentiment
Give me the current sentiment for JSW Steel shares.,stock_sentiment
Analyze JSW Steel stock sentiment from social media.,stock_sentiment
Check if Tata Motors stock is receiving positive feedback.,stock_sentiment
Are investors confident in Wipro shares?,stock_sentiment
Is the Amazon stock sentiment bullish or bearish?,stock_sentiment
How is the market feeling about ICICI Bank?,stock_sentiment
Is Tech Mahindra stock trending positively?,stock_sentiment
Is Adani Enterprises stock trending positively?,stock_sentiment
Is Dell stock bullish or bearish?,stock_sentiment
Are Bharti Airtel shares trending bullish currently?,stock_sentiment
Are investors confident in Axis Bank shares?,stock_sentiment
How is the market sentiment for Bharat Electronics stocks?,stock_sentiment
Is the Tata Steel stock sentiment bullish or bearish?,stock_sentiment
Tell me if ITC is going up or down.,stock_sentiment
Is Uber stock sentiment favorable?,stock_sentiment
Analyze Tata Steel stock sentiment from social media.,stock_sentiment
Are investors positive or negative on Amazon stock?,stock_sentiment
Tell me if Reliance Industries shares are favored by investors.,stock_sentiment
Check if Twitter stock is receiving positive feedback.,stock_sentiment
Are Facebook shares seeing increased investor confidence?,stock_sentiment
Are Microsoft shares viewed positively right now?,stock_sentiment
How is the market sentiment for Tata Elxsi stocks?,stock_sentiment
Are NTPC shares seeing positive sentiment?,stock_sentiment
Check the public sentiment for Apple stock.,stock_sentiment
Are investors positive or negative on BYJU’s stock?,stock_sentiment
Are investors positive or negative on ICICI Bank stock?,stock_sentiment
Are traders optimistic about Apple stock?,stock_sentiment
Are Meta shares favored in today’s market?,stock_sentiment
Are investors positive or negative on Infosys stock?,stock_sentiment
How is Meta stock sentiment trending?,stock_sentiment
What’s the investor sentiment for Apple today?,stock_sentiment
Tell me if Bajaj Finance shares are favored by investors.,stock_sentiment
What’s the investor mood around Netflix stock?,stock_sentiment
What’s the public sentiment for Bharat Electronics shares?,stock_sentiment
What’s the investor mood around Paytm stock?,stock_sentiment
How is the sentiment on Tata Motors stock evolving?,stock_sentiment
How are people reacting to ITC shares?,stock_sentiment
What’s the investor mood around Paytm stock?,stock_sentiment
Tell me if Twitter shares are favored by investors.,stock_sentiment
What’s the public sentiment for Wipro shares?,stock_sentiment
Check the public sentiment for BYJU’s stock.,stock_sentiment
How do investors feel about Bharti Airtel stock recently?,stock_sentiment
How are people reacting to Wipro shares?,stock_sentiment
Tell me if LIC stock is trending up.,stock_sentiment
Analyze the stock sentiment for Flipkart.,stock_sentiment
Is HUL stock sentiment favorable?,stock_sentiment
How is the sentiment on Tata Steel stock evolving?,stock_sentiment
What’s the public opinion on Microsoft stock?,stock_sentiment
Tell me if Infosys shares are favored by investors.,stock_sentiment
Are ICICI Bank shares favored in today’s market?,stock_sentiment
Is ONGC stock sentiment favorable?,stock_sentiment
