text,intent
What is the sentiment of Apple stock?,stock_sentiment
Tell me if Tesla is going up or down,stock_sentiment
Analyze the stock sentiment for Microsoft,stock_sentiment
Is Amazon stock bullish or bearish?,stock_sentiment
How is the market feeling about Nvidia?,stock_sentiment
Give me the current sentiment for Google stock,stock_sentiment
What’s the investor sentiment on Facebook shares?,stock_sentiment
Are investors positive or negative on Netflix stock?,stock_sentiment
Check the sentiment for Intel stock,stock_sentiment
How are people reacting to Twitter shares?,stock_sentiment
Is the market optimistic about AMD stock?,stock_sentiment
Tell me if Apple shares are trending up or down,stock_sentiment
What’s the mood around Tesla stock today?,stock_sentiment
Is the sentiment bullish for Microsoft right now?,stock_sentiment
Are Amazon shares expected to rise?,stock_sentiment
Analyze how investors feel about Nvidia stock,stock_sentiment
What’s the overall sentiment for Google today?,stock_sentiment
Is Facebook stock considered risky currently?,stock_sentiment
How do traders feel about Netflix shares?,stock_sentiment
Check if Intel stock is under positive sentiment,stock_sentiment
Are investors optimistic about Twitter’s stock?,stock_sentiment
What’s the latest sentiment on AMD shares?,stock_sentiment
Tell me if Apple’s stock is gaining positive buzz,stock_sentiment
What’s the current trend for Tesla stock?,stock_sentiment
Are Microsoft shares seeing positive sentiment?,stock_sentiment
Is Amazon stock getting good reviews from traders?,stock_sentiment
How is the market sentiment for Nvidia stocks?,stock_sentiment
Give me sentiment analysis for Google stock,stock_sentiment
Are investors confident in Facebook shares?,stock_sentiment
Check the public sentiment for Netflix stock,stock_sentiment
Is Intel stock showing positive signs?,stock_sentiment
How are Twitter shares perceived by traders?,stock_sentiment
Is the AMD stock sentiment bullish or bearish?,stock_sentiment
What’s the investor sentiment for Apple today?,stock_sentiment
Are traders optimistic about Tesla stock?,stock_sentiment
Is Microsoft stock trending positively?,stock_sentiment
Tell me if Amazon shares have a positive outlook,stock_sentiment
Analyze Nvidia’s stock sentiment from recent news,stock_sentiment
What’s the general market sentiment on Google stock?,stock_sentiment
Are Facebook shares viewed positively right now?,stock_sentiment
How do investors feel about Netflix stock recently?,stock_sentiment
Check the sentiment for Intel shares today,stock_sentiment
Is Twitter’s stock sentiment favorable?,stock_sentiment
Are AMD stocks in a bullish mood?,stock_sentiment
What’s the public opinion on Apple stock?,stock_sentiment
Tell me if Tesla shares are favored by investors,stock_sentiment
How is the sentiment on Microsoft shares?,stock_sentiment
Is Amazon stock viewed as bullish currently?,stock_sentiment
Analyze market sentiment for Nvidia shares,stock_sentiment
What’s the trend for Google stock sentiment?,stock_sentiment
Are Facebook shares considered stable by traders?,stock_sentiment
How do investors perceive Netflix stock right now?,stock_sentiment
Check if Intel shares are in positive sentiment,stock_sentiment
Is Twitter stock sentiment trending upward?,stock_sentiment
Are AMD stocks gaining positive feedback?,stock_sentiment
What’s the overall feeling about Apple stock?,stock_sentiment
Are Tesla shares gaining positive momentum?,stock_sentiment
Tell me if Microsoft stock is bullish or bearish,stock_sentiment
Is Amazon shares sentiment positive today?,stock_sentiment
Analyze Nvidia stock sentiment from social media,stock_sentiment
What’s the public sentiment for Google shares?,stock_sentiment
Are Facebook shares seeing increased investor confidence?,stock_sentiment
How is Netflix stock sentiment trending?,stock_sentiment
Check if Intel stock is receiving positive feedback,stock_sentiment
Is Twitter stock sentiment positive or negative?,stock_sentiment
Are AMD shares trending bullish currently?,stock_sentiment
What’s the investor mood around Apple stock?,stock_sentiment
Are Tesla shares favored in today’s market?,stock_sentiment
How is the sentiment on Microsoft stock evolving?,stock_sentiment
Is Amazon stock considered bullish right now?,stock_sentiment
Analyze Nvidia’s stock sentiment from recent trends,stock_sentiment
What’s the general sentiment for Google shares?,stock_sentiment
Are Facebook stocks viewed positively by investors?,stock_sentiment
How do traders feel about Netflix stock today?,stock_sentiment
Check the sentiment trend for Intel shares,stock_sentiment
Is Twitter stock sentiment improving?,stock_sentiment
Are AMD shares receiving positive market sentiment?,stock_sentiment
What’s the overall sentiment on Apple shares?,stock_sentiment
Are Tesla shares trending up in sentiment?,stock_sentiment
Tell me if Microsoft stock sentiment is positive,stock_sentiment
Is Amazon stock sentiment bullish or bearish?,stock_sentiment
Analyze Nvidia stock sentiment from latest news,stock_sentiment
What’s the market sentiment for Google shares?,stock_sentiment
Are Facebook shares seen as good investments now?,stock_sentiment
How is Netflix stock sentiment trending lately?,stock_sentiment
Check if Intel shares have positive investor sentiment,stock_sentiment
Is Twitter stock sentiment currently positive?,stock_sentiment
Are AMD shares favored by investors recently?,stock_sentiment
What is the sentiment of Reliance Industries stock?,stock_sentiment
Tell me if TCS is trending up or down,stock_sentiment
Analyze the stock sentiment for Infosys,stock_sentiment
Is HDFC Bank stock bullish or bearish?,stock_sentiment
How is the market feeling about ICICI Bank?,stock_sentiment
Give me the current sentiment for Larsen & Toubro stock,stock_sentiment
What’s the investor sentiment on SBI shares?,stock_sentiment
Are investors positive or negative on Bharti Airtel stock?,stock_sentiment
Check the sentiment for Asian Paints stock,stock_sentiment
How are people reacting to Bajaj Finance shares?,stock_sentiment
Is the market optimistic about Maruti Suzuki stock?,stock_sentiment
Tell me if Reliance Industries shares are trending up or down,stock_sentiment
What’s the mood around TCS stock today?,stock_sentiment
Is the sentiment bullish for Infosys right now?,stock_sentiment
Are HDFC Bank shares expected to rise?,stock_sentiment
Analyze how investors feel about ICICI Bank stock,stock_sentiment
What’s the overall sentiment for Larsen & Toubro today?,stock_sentiment
Is SBI stock considered risky currently?,stock_sentiment
How do traders feel about Bharti Airtel shares?,stock_sentiment
Check if Asian Paints stock is under positive sentiment,stock_sentiment
Are investors optimistic about Bajaj Finance’s stock?,stock_sentiment
What’s the latest sentiment on Maruti Suzuki shares?,stock_sentiment
Tell me if Reliance Industries stock is gaining positive buzz,stock_sentiment
What’s the current trend for TCS stock?,stock_sentiment
Are Infosys shares seeing positive sentiment?,stock_sentiment
Is HDFC Bank stock getting good reviews from traders?,stock_sentiment
How is the market sentiment for ICICI Bank stocks?,stock_sentiment
Give me sentiment analysis for Larsen & Toubro stock,stock_sentiment
Are investors confident in SBI shares?,stock_sentiment
Check the public sentiment for Bharti Airtel stock,stock_sentiment
Is Asian Paints stock showing positive signs?,stock_sentiment
How are Bajaj Finance shares perceived by traders?,stock_sentiment
Is the Maruti Suzuki stock sentiment bullish or bearish?,stock_sentiment
What’s the investor sentiment for Reliance Industries today?,stock_sentiment
Are traders optimistic about TCS stock?,stock_sentiment
Is Infosys stock trending positively?,stock_sentiment
Tell me if HDFC Bank shares have a positive outlook,stock_sentiment
Analyze ICICI Bank’s stock sentiment from recent news,stock_sentiment
What’s the general market sentiment on Larsen & Toubro stock?,stock_sentiment
Are SBI shares viewed positively right now?,stock_sentiment
How do investors feel about Bharti Airtel stock recently?,stock_sentiment
Check the sentiment for Asian Paints shares today,stock_sentiment
Is Bajaj Finance stock sentiment favorable?,stock_sentiment
Are Maruti Suzuki stocks in a bullish mood?,stock_sentiment
What’s the public opinion on Reliance Industries stock?,stock_sentiment
Tell me if TCS shares are favored by investors,stock_sentiment
How is the sentiment on Infosys shares?,stock_sentiment
Is HDFC Bank stock viewed as bullish currently?,stock_sentiment
Analyze ICICI Bank stock sentiment from social media,stock_sentiment
What’s the public sentiment for Larsen & Toubro shares?,stock_sentiment
Are SBI shares seeing increased investor confidence?,stock_sentiment
How is Bharti Airtel stock sentiment trending?,stock_sentiment
Check if Asian Paints stock is receiving positive feedback,stock_sentiment
Is Bajaj Finance stock sentiment positive or negative?,stock_sentiment
Are Maruti Suzuki shares trending bullish currently?,stock_sentiment
What’s the investor mood around Reliance Industries stock?,stock_sentiment
Are TCS shares favored in today’s market?,stock_sentiment
How is the sentiment on Infosys stock evolving?,stock_sentiment
Is HDFC Bank stock considered bullish right now?,stock_sentiment
Analyze ICICI Bank’s stock sentiment from recent trends,stock_sentiment
What’s the general sentiment for Larsen & Toubro shares?,stock_sentiment
Are SBI stocks viewed positively by investors?,stock_sentiment
How do traders feel about Bharti Airtel stock today?,stock_sentiment
Check the sentiment trend for Asian Paints shares,stock_sentiment
Is Bajaj Finance stock sentiment improving?,stock_sentiment
Are Maruti Suzuki shares receiving positive market sentiment?,stock_sentiment
What’s the overall sentiment on Reliance Industries shares?,stock_sentiment
Are TCS shares trending up in sentiment?,stock_sentiment
Tell me if Infosys stock sentiment is positive,stock_sentiment
Is HDFC Bank stock sentiment bullish or bearish?,stock_sentiment
Analyze ICICI Bank stock sentiment from latest news,stock_sentiment
What’s the market sentiment for Larsen & Toubro shares?,stock_sentiment
Are SBI shares seen as good investments now?,stock_sentiment
How is Bharti Airtel stock sentiment trending lately?,stock_sentiment
Check if Asian Paints shares have positive investor sentiment,stock_sentiment
Is Bajaj Finance stock sentiment currently positive?,stock_sentiment
Are Maruti Suzuki shares favored by investors recently?,stock_sentiment
What is the sentiment of Reliance Industries stock?,stock_sentiment
Tell me if Tesla is going up or down,stock_sentiment
Analyze the stock sentiment for Microsoft,stock_sentiment
Is Amazon stock bullish or bearish?,stock_sentiment
How is the market feeling about Infosys?,stock_sentiment
Give me the current sentiment for Apple shares,stock_sentiment
What’s the investor sentiment on TCS stock?,stock_sentiment
Are investors positive or negative on Google stock?,stock_sentiment
Check the sentiment for ICICI Bank stock,stock_sentiment
How are people reacting to Nvidia shares?,stock_sentiment
Is HDFC Bank stock showing bullish signs?,stock_sentiment
Tell me if Facebook stock is trending up,stock_sentiment
What’s the mood around Amazon stock today?,stock_sentiment
Are Infosys shares seeing positive sentiment?,stock_sentiment
Is HDFC Bank stock getting good reviews from traders?,stock_sentiment
How is the market sentiment for ICICI Bank stocks?,stock_sentiment
Give me sentiment analysis for Tesla stock,stock_sentiment
Are investors confident in SBI shares?,stock_sentiment
Check the public sentiment for Bharti Airtel stock,stock_sentiment
Is Asian Paints stock showing positive signs?,stock_sentiment
How are Bajaj Finance shares perceived by traders?,stock_sentiment
Is the Maruti Suzuki stock sentiment bullish or bearish?,stock_sentiment
What’s the investor sentiment for Reliance Industries today?,stock_sentiment
Are traders optimistic about Apple stock?,stock_sentiment
Is Infosys stock trending positively?,stock_sentiment
Tell me if HDFC Bank shares have a positive outlook,stock_sentiment
Analyze ICICI Bank’s stock sentiment from recent news,stock_sentiment
What’s the general market sentiment on Larsen & Toubro stock?,stock_sentiment
Are SBI shares viewed positively right now?,stock_sentiment
How do investors feel about Bharti Airtel stock recently?,stock_sentiment
Check the sentiment for Asian Paints shares today,stock_sentiment
Is Bajaj Finance stock sentiment favorable?,stock_sentiment
Are Maruti Suzuki shares in a bullish mood?,stock_sentiment
What’s the public opinion on Reliance Industries stock?,stock_sentiment
Tell me if Netflix shares are favored by investors,stock_sentiment
How is the sentiment on Infosys shares?,stock_sentiment
Is HDFC Bank stock viewed as bullish currently?,stock_sentiment
Analyze ICICI Bank stock sentiment from social media,stock_sentiment
What’s the public sentiment for Larsen & Toubro shares?,stock_sentiment
Are SBI shares seeing increased investor confidence?,stock_sentiment
How is Bharti Airtel stock sentiment trending?,stock_sentiment
Check if Asian Paints stock is receiving positive feedback,stock_sentiment
Is Bajaj Finance stock sentiment positive or negative?,stock_sentiment
Are Maruti Suzuki shares trending bullish currently?,stock_sentiment
What’s the investor mood around Reliance Industries stock?,stock_sentiment
Are TCS shares favored in today’s market?,stock_sentiment
How is the sentiment on Infosys stock evolving?,stock_sentiment
Is HDFC Bank stock considered bullish right now?,stock_sentiment
Analyze ICICI Bank’s stock sentiment from recent trends,stock_sentiment
What’s the general sentiment for Larsen & Toubro shares?,stock_sentiment
Are SBI stocks viewed positively by investors?,stock_sentiment
How do traders feel about Bharti Airtel stock today?,stock_sentiment
Check the sentiment trend for Asian Paints shares,stock_sentiment
Is Bajaj Finance stock sentiment improving?,stock_sentiment
Are Maruti Suzuki shares receiving positive market sentiment?,stock_sentiment
What’s the overall sentiment on Reliance Industries shares?,stock_sentiment
Are TCS shares trending up in sentiment?,stock_sentiment
Tell me if Infosys stock sentiment is positive,stock_sentiment
Is HDFC Bank stock sentiment bullish or bearish?,stock_sentiment
Analyze ICICI Bank stock sentiment from latest news,stock_sentiment
What’s the market sentiment for Larsen & Toubro shares?,stock_sentiment
Are SBI shares seen as good investments now?,stock_sentiment
How is Bharti Airtel stock sentiment trending lately?,stock_sentiment
Check if Asian Paints shares have positive investor sentiment,stock_sentiment
Is Bajaj Finance stock sentiment currently positive?,stock_sentiment
Are Maruti Suzuki shares favored by investors recently?,stock_sentiment
What is the sentiment of Coca-Cola stock?,stock_sentiment
Is Google stock showing a positive trend?,stock_sentiment
Analyze the sentiment for Walmart shares,stock_sentiment
Is IBM stock bullish or bearish?,stock_sentiment
What is the sentiment on Netflix shares?,stock_sentiment
How is the market sentiment on Pfizer stock?,stock_sentiment
Are investors optimistic about Adobe stock?,stock_sentiment
What’s the sentiment on Zoom Video Communications stock?,stock_sentiment
Is Boeing stock viewed positively by traders?,stock_sentiment
Analyze sentiment for ExxonMobil shares,stock_sentiment
Is Twitter stock trending up or down?,stock_sentiment
Tell me the market feeling about Spotify stock,stock_sentiment
Are investors bullish on Uber Technologies?,stock_sentiment
What’s the sentiment for PayPal stock?,stock_sentiment
Is the sentiment positive for Shopify stock?,stock_sentiment
What is the current sentiment for Adani Enterprises stock?,stock_sentiment
How are investors feeling about Wipro shares?,stock_sentiment
Analyze the sentiment around Paytm stock,stock_sentiment
Is Bajaj Auto stock showing bullish trends?,stock_sentiment
What’s the market mood on Tata Steel shares?,stock_sentiment
Tell me if Ford stock is trending positively,stock_sentiment
Check the sentiment for HCL Technologies shares,stock_sentiment
Are investors optimistic about Netflix stock?,stock_sentiment
How is the sentiment on Asian Paints stock?,stock_sentiment
Is Sony stock bullish or bearish today?,stock_sentiment
What’s the investor sentiment on ITC stock?,stock_sentiment
How do traders feel about Ford shares recently?,stock_sentiment
Check sentiment for Cipla stock,stock_sentiment
Is Tesla stock viewed positively by investors now?,stock_sentiment
What’s the sentiment on Maruti Suzuki shares?,stock_sentiment
Tell me if Axis Bank shares are favored by traders,stock_sentiment
Analyze the market sentiment for Google stock,stock_sentiment
Are investors positive about Britannia Industries shares?,stock_sentiment
How is the sentiment on Reliance Industries today?,stock_sentiment
Is Zoom stock trending up in investor sentiment?,stock_sentiment
What’s the public opinion on Coal India stock?,stock_sentiment
Check if Pfizer shares have bullish sentiment,stock_sentiment
Are Bharti Airtel shares viewed favorably by investors?,stock_sentiment
How do traders feel about Microsoft stock lately?,stock_sentiment
Is Infosys stock receiving positive market feedback?,stock_sentiment
What is the market mood on ICICI Bank shares?,stock_sentiment
Are investors optimistic about Amazon stock?,stock_sentiment
Tell me the sentiment trend for Wipro shares,stock_sentiment
How is the sentiment for Apple stock evolving?,stock_sentiment
Is Larsen & Toubro stock showing positive signs?,stock_sentiment
Analyze the sentiment of Tesla stock from social media,stock_sentiment
Are SBI shares viewed as bullish right now?,stock_sentiment
What is the current sentiment on Google shares?,stock_sentiment
How are traders feeling about Tata Motors stock?,stock_sentiment
Is Uber Technologies stock trending positively?,stock_sentiment
Check the sentiment for Nestle India shares,stock_sentiment
What’s the investor mood on Bajaj Finance stock?,stock_sentiment
Tell me if Facebook stock is bullish or bearish,stock_sentiment
How is the sentiment on HDFC Bank stock?,stock_sentiment
Are investors confident in Paytm shares?,stock_sentiment
What is the sentiment on Netflix shares today?,stock_sentiment
Is Reliance Industries stock viewed positively by traders?,stock_sentiment
How do investors feel about Axis Bank stock?,stock_sentiment
Check if Coca-Cola shares have positive sentiment,stock_sentiment
What is the market sentiment for Tata Steel shares?,stock_sentiment
Are traders optimistic about Sony stock?,stock_sentiment
How is the sentiment trend for ICICI Bank shares?,stock_sentiment
Tell me if Microsoft stock is receiving positive reviews,stock_sentiment
Analyze the sentiment on Wipro stock from recent news,stock_sentiment
Are investors bullish on Bajaj Auto shares?,stock_sentiment
What’s the sentiment on Asian Paints stock currently?,stock_sentiment
How do traders view Larsen & Toubro stock?,stock_sentiment
Is Amazon stock trending positively today?,stock_sentiment
What’s the market feeling about Pfizer stock?,stock_sentiment
Are investors optimistic about Uber Technologies stock?,stock_sentiment
Tell me if Facebook shares are trending bullish,stock_sentiment
How is the sentiment on Nestle India stock?,stock_sentiment
Check the public sentiment for Britannia Industries stock,stock_sentiment
Is Coca-Cola stock viewed favorably by traders?,stock_sentiment
Analyze the market sentiment on Ford stock,stock_sentiment
Are Tesla shares bullish or bearish right now?,stock_sentiment
What’s the sentiment for Bajaj Finance shares?,stock_sentiment
Tell me if Infosys stock is trending positively,stock_sentiment
How is the sentiment on Axis Bank stock evolving?,stock_sentiment
Are investors confident about Tata Motors shares?,stock_sentiment
What’s the current market sentiment for HCL Technologies?,stock_sentiment
Is Reliance Industries stock sentiment bullish today?,stock_sentiment
Check the investor sentiment for ICICI Bank shares,stock_sentiment
How do traders feel about Microsoft stock?,stock_sentiment
What’s the general mood about Netflix stock?,stock_sentiment
Tell me if Tata Steel shares are favored by investors,stock_sentiment
Is Uber stock viewed positively by market participants?,stock_sentiment
Analyze the sentiment for Amazon shares from social media,stock_sentiment
Are Facebook shares trending up or down?,stock_sentiment
What’s the current sentiment on Apple stock?,stock_sentiment
What’s the investor sentiment on Dr. Reddy’s Laboratories shares?,stock_sentiment
How is the market feeling about Qualcomm stock?,stock_sentiment
Is the sentiment positive for State Bank of India shares?,stock_sentiment
Tell me the current mood around Goldman Sachs stock,stock_sentiment
Are investors bullish on ICICI Prudential Life shares?,stock_sentiment
Analyze the sentiment on Johnson & Johnson stock,stock_sentiment
What is the general sentiment for Larsen & Toubro Infotech stock?,stock_sentiment
How are traders feeling about Mahindra & Mahindra shares?,stock_sentiment
Is the market sentiment optimistic for Boeing stock?,stock_sentiment
Check the sentiment for Nestle India stock,stock_sentiment
What’s the sentiment trend for HDFC Life shares?,stock_sentiment
Are investors positive about Apple Inc stock recently?,stock_sentiment
How do market participants view Axis Bank shares now?,stock_sentiment
Tell me if Tata Consultancy Services shares have bullish sentiment,stock_sentiment
What is the investor mood on Facebook stock?,stock_sentiment
Analyze the sentiment for Infosys stock from recent reports,stock_sentiment
Are traders optimistic about Netflix shares?,stock_sentiment
How is the sentiment on Adani Ports stock?,stock_sentiment
What’s the sentiment for Tesla stock after latest earnings?,stock_sentiment
Tell me if Reliance Industries shares are favored by investors today,stock_sentiment
How do investors feel about PepsiCo stock?,stock_sentiment
Is the market mood positive for Bajaj Finance shares?,stock_sentiment
Check if Wipro stock is bullish or bearish,stock_sentiment
What is the sentiment on Maruti Suzuki stock currently?,stock_sentiment
Are investors confident about Bharti Airtel shares?,stock_sentiment
How do traders view Cisco Systems stock?,stock_sentiment
Is Tata Power stock trending up or down in sentiment?,stock_sentiment
What’s the investor sentiment on Uber Technologies shares?,stock_sentiment
Tell me if Bajaj Auto stock is viewed positively by traders,stock_sentiment
How is the sentiment on Johnson Controls stock?,stock_sentiment
Are investors bullish on Oil and Natural Gas Corporation shares?,stock_sentiment
What is the current sentiment trend for Facebook stock?,stock_sentiment
Analyze the market mood for ICICI Bank shares,stock_sentiment
Is the sentiment favorable for Britannia Industries shares?,stock_sentiment
How do investors feel about Qualcomm shares?,stock_sentiment
What is the sentiment on Tata Chemicals stock?,stock_sentiment
Tell me if Apple stock has positive sentiment this week,stock_sentiment
Are traders optimistic about Infosys shares currently?,stock_sentiment
How is the market sentiment on Siemens India stock?,stock_sentiment
What’s the investor mood on Ford Motor Company shares?,stock_sentiment
Is Reliance Industries stock trending positively this month?,stock_sentiment
Check sentiment for Tata Steel shares,stock_sentiment
Are investors confident about Nestle India stock?,stock_sentiment
Tell me if Microsoft stock is bullish or bearish today,stock_sentiment
What’s the sentiment for Asian Paints shares?,stock_sentiment
Analyze the current sentiment on Bajaj Finance stock,stock_sentiment
Is the investor sentiment positive for Tata Motors shares?,stock_sentiment
How do traders feel about Amazon stock now?,stock_sentiment
What is the market sentiment on HDFC Bank stock?,stock_sentiment
Are investors bullish on Bharti Airtel stock today?,stock_sentiment
Tell me the general sentiment for Tesla stock,stock_sentiment
How is the sentiment on Infosys stock trending?,stock_sentiment
Is Wipro stock receiving positive market feedback?,stock_sentiment
What’s the investor mood on ICICI Prudential Life shares?,stock_sentiment
Analyze sentiment trends for Maruti Suzuki stock,stock_sentiment
Are traders optimistic about Tata Power shares?,stock_sentiment
What’s the sentiment for State Bank of India stock?,stock_sentiment
Tell me if Uber stock has positive sentiment currently,stock_sentiment
How do investors feel about Pfizer shares?,stock_sentiment
Is the market sentiment favorable for Larsen & Toubro Infotech?,stock_sentiment
What’s the current investor sentiment on Apple stock?,stock_sentiment
Check the sentiment for Asian Paints stock,stock_sentiment
What is the investor mood on Tata Steel shares?,stock_sentiment
Are traders optimistic about Reliance Industries stock?,stock_sentiment
Tell me if Infosys stock is bullish or bearish today,stock_sentiment
How is the market sentiment on Microsoft shares?,stock_sentiment
Is the investor sentiment positive for ICICI Bank shares?,stock_sentiment
What’s the sentiment for Bajaj Finance stock?,stock_sentiment
Analyze the sentiment for Tesla stock,stock_sentiment
Are investors confident about HDFC Bank stock?,stock_sentiment
How do traders feel about Amazon shares?,stock_sentiment
