,text,intent
840,is the bharat electronics stock sentiment bullish or bearish,stock_sentiment
841,is the adani enterprises stock sentiment bullish or bearish,stock_sentiment
842,whats the investor sentiment for tesla today,stock_sentiment
843,how are people reacting to icici bank shares,stock_sentiment
844,is flipkart stock trending positively,stock_sentiment
845,are flipkart shares favored in todays market,stock_sentiment
846,are bharti airtel shares viewed positively right now,stock_sentiment
847,are traders optimistic about byjus stock,stock_sentiment
848,check the sentiment for tata steel stock,stock_sentiment
849,are infosys shares trending bullish currently,stock_sentiment
850,how is the market feeling about tata elxsi,stock_sentiment
851,how are icici bank shares perceived by traders,stock_sentiment
853,give me the current sentiment for icici bank shares,stock_sentiment
854,how is flipkart stock sentiment trending,stock_sentiment
855,are ashok leyland shares in a bullish mood,stock_sentiment
856,check if netflix stock is receiving positive feedback,stock_sentiment
857,how are people reacting to dell shares,stock_sentiment
858,check the sentiment for vedanta stock,stock_sentiment
859,whats the investor mood around hul stock,stock_sentiment
862,whats the investor sentiment on meta stock,stock_sentiment
863,are reliance industries shares viewed positively right now,stock_sentiment
864,are asian paints shares favored in todays market,stock_sentiment
865,are investors positive or negative on hul stock,stock_sentiment
866,give me sentiment analysis for microsoft stock,stock_sentiment
867,are icici bank shares viewed positively right now,stock_sentiment
868,tell me if marico stock is trending up,stock_sentiment
869,are investors confident in reliance industries shares,stock_sentiment
870,how do investors feel about dell stock recently,stock_sentiment
871,how do investors feel about infosys stock recently,stock_sentiment
872,how are people reacting to google shares,stock_sentiment
873,is the asian paints stock sentiment bullish or bearish,stock_sentiment
874,whats the public sentiment for reliance industries shares,stock_sentiment
875,whats the investor sentiment for hul today,stock_sentiment
876,are tech mahindra shares seeing positive sentiment,stock_sentiment
877,give me the current sentiment for apple shares,stock_sentiment
878,are ntpc shares viewed positively right now,stock_sentiment
879,whats the investor sentiment for itc today,stock_sentiment
880,how is the market feeling about wipro,stock_sentiment
881,whats the general market sentiment on tech mahindra stock,stock_sentiment
884,whats the investor mood around bajaj finance stock,stock_sentiment
885,is uber stock viewed as bullish currently,stock_sentiment
887,is tata motors stock sentiment positive or negative,stock_sentiment
888,analyze the stock sentiment for ntpc,stock_sentiment
889,check the sentiment for byjus stock,stock_sentiment
891,analyze byjuss stock sentiment from recent news,stock_sentiment
892,is bajaj finance stock trending positively,stock_sentiment
893,how are sbi shares perceived by traders,stock_sentiment
894,whats the investor sentiment for maruti suzuki today,stock_sentiment
895,analyze the stock sentiment for icici bank,stock_sentiment
896,how is the sentiment on byjus stock evolving,stock_sentiment
897,give me sentiment analysis for britannia stock,stock_sentiment
898,check if infosys stock is receiving positive feedback,stock_sentiment
900,give me the current sentiment for uber shares,stock_sentiment
901,how is the market sentiment for zomato stocks,stock_sentiment
902,analyze meta stock sentiment from social media,stock_sentiment
903,are investors confident in itc shares,stock_sentiment
904,whats the investor mood around tcs stock,stock_sentiment
905,are vedanta shares viewed positively right now,stock_sentiment
906,tell me if flipkart shares are favored by investors,stock_sentiment
907,whats the investor sentiment on apple stock,stock_sentiment
908,are meta shares viewed positively right now,stock_sentiment
909,are infosys shares seeing increased investor confidence,stock_sentiment
910,analyze the stock sentiment for paytm,stock_sentiment
911,is google stock showing bullish signs,stock_sentiment
913,whats the investor mood around byjus stock,stock_sentiment
914,how are tata motors shares perceived by traders,stock_sentiment
915,whats the mood around nvidia stock today,stock_sentiment
916,tell me if hdfc bank shares are favored by investors,stock_sentiment
918,how are ashok leyland shares perceived by traders,stock_sentiment
919,how are tata elxsi shares perceived by traders,stock_sentiment
920,is tata motors stock showing bullish signs,stock_sentiment
921,is bharat electronics stock sentiment favorable,stock_sentiment
922,what is the sentiment of amazon stock,stock_sentiment
923,whats the general market sentiment on vedanta stock,stock_sentiment
924,are apple shares favored in todays market,stock_sentiment
925,tell me if tcs shares are favored by investors,stock_sentiment
926,give me sentiment analysis for tech mahindra stock,stock_sentiment
927,how is the sentiment on ntpc stock evolving,stock_sentiment
928,are lic shares viewed positively right now,stock_sentiment
929,whats the investor sentiment for tcs today,stock_sentiment
930,give me sentiment analysis for icici bank stock,stock_sentiment
931,how is the market sentiment for dell stocks,stock_sentiment
932,how is the sentiment on apple stock evolving,stock_sentiment
933,how is the market sentiment for infosys stocks,stock_sentiment
934,tell me if ashok leyland is going up or down,stock_sentiment
935,what is the sentiment of bharti airtel stock,stock_sentiment
936,is sbi stock bullish or bearish,stock_sentiment
937,is bharti airtel stock trending positively,stock_sentiment
939,are netflix shares seeing increased investor confidence,stock_sentiment
940,are google shares favored in todays market,stock_sentiment
941,check if itc stock is receiving positive feedback,stock_sentiment
942,how is the market sentiment for asian paints stocks,stock_sentiment
943,check the sentiment for tata motors stock,stock_sentiment
944,whats the public opinion on paytm stock,stock_sentiment
946,check the public sentiment for britannia stock,stock_sentiment
947,is apple stock sentiment favorable,stock_sentiment
948,is apple stock showing positive signs,stock_sentiment
949,check if lic stock is receiving positive feedback,stock_sentiment
950,give me sentiment analysis for reliance industries stock,stock_sentiment
951,are nvidia shares seeing positive sentiment,stock_sentiment
952,are traders optimistic about tech mahindra stock,stock_sentiment
953,analyze the stock sentiment for tata motors,stock_sentiment
954,is flipkart stock showing bullish signs,stock_sentiment
955,how do investors feel about ntpc stock recently,stock_sentiment
956,are netflix shares seeing positive sentiment,stock_sentiment
958,are meta shares trending bullish currently,stock_sentiment
960,whats the public sentiment for ashok leyland shares,stock_sentiment
961,is nvidia stock trending positively,stock_sentiment
962,check the sentiment for dell shares today,stock_sentiment
963,is the axis bank stock sentiment bullish or bearish,stock_sentiment
964,how are people reacting to britannia shares,stock_sentiment
965,analyze dells stock sentiment from recent news,stock_sentiment
966,whats the mood around twitter stock today,stock_sentiment
968,how do investors feel about uber stock recently,stock_sentiment
971,what is the sentiment of microsoft stock,stock_sentiment
972,are apple shares viewed positively right now,stock_sentiment
973,is the hdfc bank stock sentiment bullish or bearish,stock_sentiment
974,give me the current sentiment for asian paints shares,stock_sentiment
975,how is the sentiment on netflix shares,stock_sentiment
976,is the jsw steel stock sentiment bullish or bearish,stock_sentiment
977,is britannia stock showing positive signs,stock_sentiment
979,whats the general market sentiment on tata motors stock,stock_sentiment
980,check if wipro stock is receiving positive feedback,stock_sentiment
981,how is the sentiment on tata elxsi shares,stock_sentiment
982,check if tata elxsi stock is receiving positive feedback,stock_sentiment
983,check the public sentiment for google stock,stock_sentiment
984,check the sentiment for hdfc bank stock,stock_sentiment
985,whats the investor mood around tata motors stock,stock_sentiment
986,how is zomato stock sentiment trending,stock_sentiment
987,whats the investor mood around bharat electronics stock,stock_sentiment
990,are traders optimistic about ashok leyland stock,stock_sentiment
991,analyze netflixs stock sentiment from recent news,stock_sentiment
993,is wipro stock sentiment favorable,stock_sentiment
994,check the sentiment for byjus shares today,stock_sentiment
995,whats the mood around dell stock today,stock_sentiment
996,tell me if hul shares have a positive outlook,stock_sentiment
997,whats the public sentiment for icici bank shares,stock_sentiment
998,give me sentiment analysis for nvidia stock,stock_sentiment
999,whats the investor sentiment on tech mahindra stock,stock_sentiment
1000,analyze the stock sentiment for hdfc bank,stock_sentiment
1002,give me sentiment analysis for hul stock,stock_sentiment
1003,how is the sentiment on bajaj finance shares,stock_sentiment
1004,check the sentiment for itc shares today,stock_sentiment
1005,is axis bank stock viewed as bullish currently,stock_sentiment
1006,tell me if asian paints stock is trending up,stock_sentiment
1007,are lic shares trending bullish currently,stock_sentiment
1008,check the public sentiment for reliance industries stock,stock_sentiment
1010,how is reliance industries stock sentiment trending,stock_sentiment
1013,is facebook stock getting good reviews from traders,stock_sentiment
1014,is adani enterprises stock viewed as bullish currently,stock_sentiment
1015,whats the investor sentiment for google today,stock_sentiment
1016,whats the public sentiment for britannia shares,stock_sentiment
1017,how is the sentiment on bajaj finance stock evolving,stock_sentiment
1018,check the sentiment for bharti airtel stock,stock_sentiment
1019,is tata motors stock viewed as bullish currently,stock_sentiment
1020,are investors positive or negative on paytm stock,stock_sentiment
1021,whats the mood around ntpc stock today,stock_sentiment
1022,are amazon shares seeing increased investor confidence,stock_sentiment
1023,are tata elxsi shares viewed positively right now,stock_sentiment
1024,how is the market sentiment for britannia stocks,stock_sentiment
1025,how are microsoft shares perceived by traders,stock_sentiment
1026,is marico stock getting good reviews from traders,stock_sentiment
1029,how are itc shares perceived by traders,stock_sentiment
1030,what is the sentiment of lic stock,stock_sentiment
1031,how are people reacting to hdfc bank shares,stock_sentiment
1033,check the public sentiment for jsw steel stock,stock_sentiment
1034,is meta stock showing bullish signs,stock_sentiment
1035,are investors confident in google shares,stock_sentiment
1036,analyze tech mahindras stock sentiment from recent news,stock_sentiment
1037,how is the market sentiment for hdfc bank stocks,stock_sentiment
1039,is uber stock getting good reviews from traders,stock_sentiment
1040,how is the sentiment on reliance industries stock evolving,stock_sentiment
1041,tell me if wipro is going up or down,stock_sentiment
1042,check the sentiment for facebook shares today,stock_sentiment
1043,whats the investor sentiment for bajaj finance today,stock_sentiment
1044,how are apple shares perceived by traders,stock_sentiment
1045,give me sentiment analysis for bharti airtel stock,stock_sentiment
1047,is flipkart stock sentiment favorable,stock_sentiment
1048,are zomato shares viewed positively right now,stock_sentiment
1049,analyze britannias stock sentiment from recent news,stock_sentiment
1051,are investors positive or negative on ntpc stock,stock_sentiment
1054,how is the sentiment on flipkart shares,stock_sentiment
1057,how is the market feeling about jsw steel,stock_sentiment
1058,whats the investor sentiment for twitter today,stock_sentiment
1059,are traders optimistic about nvidia stock,stock_sentiment
1060,check the sentiment for amazon stock,stock_sentiment
1061,tell me if byjus shares have a positive outlook,stock_sentiment
1062,check the sentiment for tech mahindra shares today,stock_sentiment
1063,check the sentiment for jsw steel shares today,stock_sentiment
1064,how is the market feeling about itc,stock_sentiment
1065,is wipro stock getting good reviews from traders,stock_sentiment
1066,whats the public sentiment for tata elxsi shares,stock_sentiment
1067,check the sentiment for wipro stock,stock_sentiment
1068,how is the market sentiment for paytm stocks,stock_sentiment
1069,tell me if reliance industries is going up or down,stock_sentiment
1071,is meta stock bullish or bearish,stock_sentiment
1073,are bharti airtel shares in a bullish mood,stock_sentiment
1074,check the sentiment for maruti suzuki shares today,stock_sentiment
1075,are zomato shares in a bullish mood,stock_sentiment
1076,how do investors feel about icici bank stock recently,stock_sentiment
1077,analyze the stock sentiment for britannia,stock_sentiment
1078,check the public sentiment for flipkart stock,stock_sentiment
1079,how is the market sentiment for netflix stocks,stock_sentiment
1080,check the sentiment for dell stock,stock_sentiment
1083,is tech mahindra stock viewed as bullish currently,stock_sentiment
1084,tell me if paytm shares have a positive outlook,stock_sentiment
1085,is itc stock sentiment favorable,stock_sentiment
1086,is ashok leyland stock getting good reviews from traders,stock_sentiment
1087,how is the sentiment on ongc shares,stock_sentiment
1088,tell me if google shares are favored by investors,stock_sentiment
1089,are tata steel shares seeing positive sentiment,stock_sentiment
1090,are investors confident in tcs shares,stock_sentiment
1092,whats the investor sentiment for hdfc bank today,stock_sentiment
1094,how is the sentiment on bharat electronics stock evolving,stock_sentiment
1095,give me sentiment analysis for tcs stock,stock_sentiment
1096,whats the general market sentiment on microsoft stock,stock_sentiment
1100,tell me if ongc stock is trending up,stock_sentiment
1101,is paytm stock trending positively,stock_sentiment
1102,what is the sentiment of sbi stock,stock_sentiment
1103,what is the sentiment of adani enterprises stock,stock_sentiment
1105,tell me if nvidia stock is trending up,stock_sentiment
1106,tell me if britannia shares have a positive outlook,stock_sentiment
1108,give me sentiment analysis for ashok leyland stock,stock_sentiment
1109,is flipkart stock showing positive signs,stock_sentiment
1110,how is britannia stock sentiment trending,stock_sentiment
1111,are bharti airtel shares favored in todays market,stock_sentiment
1112,tell me if bajaj finance is going up or down,stock_sentiment
1113,whats the general market sentiment on infosys stock,stock_sentiment
1114,is tata motors stock bullish or bearish,stock_sentiment
1115,are paytm shares seeing positive sentiment,stock_sentiment
1117,whats the mood around netflix stock today,stock_sentiment
1118,tell me if britannia stock is trending up,stock_sentiment
1119,is infosys stock sentiment favorable,stock_sentiment
1120,tell me if nvidia is going up or down,stock_sentiment
1121,check the sentiment for zomato shares today,stock_sentiment
1124,whats the public opinion on tech mahindra stock,stock_sentiment
1125,are marico shares in a bullish mood,stock_sentiment
1126,whats the public sentiment for jsw steel shares,stock_sentiment
1128,whats the public opinion on ongc stock,stock_sentiment
1129,are investors confident in lic shares,stock_sentiment
1130,whats the public sentiment for amazon shares,stock_sentiment
1131,is the ongc stock sentiment bullish or bearish,stock_sentiment
1132,how is the market feeling about netflix,stock_sentiment
1133,tell me if adani enterprises stock is trending up,stock_sentiment
1134,is the paytm stock sentiment bullish or bearish,stock_sentiment
1136,whats the investor mood around nvidia stock,stock_sentiment
1137,is ashok leyland stock sentiment favorable,stock_sentiment
1141,is asian paints stock showing bullish signs,stock_sentiment
1144,check if bharat electronics stock is receiving positive feedback,stock_sentiment
1145,are uber shares in a bullish mood,stock_sentiment
1146,analyze sbi stock sentiment from social media,stock_sentiment
1148,how is the sentiment on dell stock evolving,stock_sentiment
1149,are tata steel shares in a bullish mood,stock_sentiment
1150,how is the sentiment on tata elxsi stock evolving,stock_sentiment
1152,is facebook stock sentiment positive or negative,stock_sentiment
1153,tell me if itc shares are favored by investors,stock_sentiment
1154,is jsw steel stock showing bullish signs,stock_sentiment
1155,tell me if microsoft is going up or down,stock_sentiment
1157,are vedanta shares seeing increased investor confidence,stock_sentiment
1159,is wipro stock sentiment positive or negative,stock_sentiment
1160,analyze tesla stock sentiment from social media,stock_sentiment
1161,is bajaj finance stock showing bullish signs,stock_sentiment
1163,are investors positive or negative on wipro stock,stock_sentiment
1164,analyze marico stock sentiment from social media,stock_sentiment
1165,give me sentiment analysis for lic stock,stock_sentiment
1166,are google shares seeing positive sentiment,stock_sentiment
1168,how is the sentiment on axis bank shares,stock_sentiment
1169,how is the sentiment on ongc stock evolving,stock_sentiment
1170,are adani enterprises shares trending bullish currently,stock_sentiment
1172,are investors positive or negative on ongc stock,stock_sentiment
1175,how is the market feeling about byjus,stock_sentiment
1176,tell me if tcs stock is trending up,stock_sentiment
1181,analyze the stock sentiment for adani enterprises,stock_sentiment
1183,whats the investor sentiment for tata steel today,stock_sentiment
1184,whats the public opinion on dell stock,stock_sentiment
1185,analyze bharti airtels stock sentiment from recent news,stock_sentiment
1186,tell me if asian paints shares are favored by investors,stock_sentiment
1188,is axis bank stock sentiment positive or negative,stock_sentiment
1189,whats the general market sentiment on icici bank stock,stock_sentiment
1190,whats the investor sentiment for flipkart today,stock_sentiment
