,text,intent
434,how do investors feel about tata consultancy services shares,stock_sentiment
435,whats the sentiment for mahindra mahindra stock,stock_sentiment
436,are traders optimistic about netflix stock,stock_sentiment
437,check the sentiment on icici prudential life stock,stock_sentiment
438,tell me if tesla stock has bullish sentiment,stock_sentiment
439,how is the market sentiment on reliance industries stock,stock_sentiment
440,whats the investor mood on bajaj auto shares,stock_sentiment
441,are investors confident about larsen toubro stock,stock_sentiment
442,tell me if facebook stock is viewed positively,stock_sentiment
443,how do traders feel about uber stock,stock_sentiment
444,is the market sentiment favorable for tata motors stock,stock_sentiment
445,analyze the investor sentiment on johnson johnson shares,stock_sentiment
446,whats the sentiment trend for infosys shares,stock_sentiment
447,are investors bullish on apple stock today,stock_sentiment
448,tell me if bajaj finance stock has positive sentiment,stock_sentiment
450,whats the investor sentiment on nestle india shares,stock_sentiment
451,are traders optimistic about state bank of india stock,stock_sentiment
452,check if amazon stock is bullish or bearish,stock_sentiment
453,tell me the current sentiment on microsoft shares,stock_sentiment
454,whats the sentiment on maruti suzuki stock,stock_sentiment
455,are traders bullish on tata steel shares,stock_sentiment
456,analyze investor mood for reliance industries today,stock_sentiment
457,is the market sentiment positive for infosys stock,stock_sentiment
458,tell me if tesla shares have bullish sentiment now,stock_sentiment
459,how do investors feel about icici bank stock today,stock_sentiment
460,check if amazon stock is being viewed positively,stock_sentiment
461,whats the sentiment trend for asian paints shares,stock_sentiment
462,are traders optimistic about hdfc bank shares,stock_sentiment
463,tell me if microsoft stock is gaining positive sentiment,stock_sentiment
464,how is the investor mood on bharti airtel stock,stock_sentiment
465,is the market sentiment bullish for tata motors shares,stock_sentiment
466,analyze current sentiment for facebook stock,stock_sentiment
467,are investors confident about bajaj finance stock,stock_sentiment
468,tell me if wipro stock sentiment is positive today,stock_sentiment
469,whats the investor mood for netflix shares,stock_sentiment
470,how do traders feel about larsen toubro stock,stock_sentiment
471,check the sentiment for johnson johnson stock,stock_sentiment
472,is the market optimistic about tata power shares,stock_sentiment
473,tell me if uber stock is experiencing bullish sentiment,stock_sentiment
474,whats the sentiment on pfizer stock today,stock_sentiment
475,are investors positive about icici prudential life shares,stock_sentiment
476,how is the market feeling about ford motor company stock,stock_sentiment
477,tell me if sony stock has positive investor sentiment,stock_sentiment
478,check if apple stock is showing bullish signals,stock_sentiment
479,whats the sentiment on tata chemicals shares,stock_sentiment
481,analyze the sentiment for boeing stock,stock_sentiment
483,is the market mood positive for bajaj auto stock,stock_sentiment
484,tell me the current sentiment on britannia industries stock,stock_sentiment
485,are traders bullish on tata consultancy services shares,stock_sentiment
486,whats the investor sentiment on state bank of india stock,stock_sentiment
487,check if amazon shares have positive sentiment,stock_sentiment
488,how do investors feel about facebook stock today,stock_sentiment
489,is the market optimistic about maruti suzuki shares,stock_sentiment
490,tell me if tesla stock is showing bearish signs,stock_sentiment
491,analyze current investor sentiment for icici bank shares,stock_sentiment
492,whats the sentiment trend for infosys stock,stock_sentiment
493,are traders bullish on larsen toubro infotech shares,stock_sentiment
494,tell me if microsoft shares are viewed positively,stock_sentiment
495,how do investors feel about bajaj finance stock,stock_sentiment
496,is the market mood favorable for tata motors stock,stock_sentiment
497,check the investor sentiment on netflix shares,stock_sentiment
498,whats the market feeling about icici prudential life stock,stock_sentiment
500,tell me if reliance industries stock sentiment is bullish,stock_sentiment
501,how do investors feel about bajaj auto stock today,stock_sentiment
502,is the market positive about tata steel shares,stock_sentiment
503,check if amazon stock is showing bullish momentum,stock_sentiment
504,tell me the current investor mood for microsoft shares,stock_sentiment
505,are investors confident about hdfc life stock,stock_sentiment
506,whats the sentiment on bharti airtel shares today,stock_sentiment
507,analyze the market sentiment for larsen toubro stock,stock_sentiment
508,is the investor mood positive for tesla stock,stock_sentiment
509,how do traders feel about tata consultancy services shares,stock_sentiment
510,tell me if apple stock is showing positive sentiment,stock_sentiment
511,are investors bullish on netflix stock,stock_sentiment
512,whats the sentiment trend for facebook shares,stock_sentiment
513,check if icici bank shares are viewed positively,stock_sentiment
514,how is the market mood about infosys stock,stock_sentiment
515,tell me if tata power stock has bullish sentiment,stock_sentiment
516,are traders optimistic about amazon stock today,stock_sentiment
517,whats the sentiment on hcl technologies stock,stock_sentiment
518,are investors bullish about mahindra mahindra shares,stock_sentiment
519,analyze market mood for paytm stock,stock_sentiment
520,is the sentiment positive for google stock today,stock_sentiment
521,tell me if wipro shares are gaining bullish momentum,stock_sentiment
522,how do traders feel about sbi life stock,stock_sentiment
523,is tesla stock being viewed negatively,stock_sentiment
524,whats the current investor sentiment for ultratech cement,stock_sentiment
525,are traders optimistic about ibm shares,stock_sentiment
526,tell me if tata consumer products stock is bullish,stock_sentiment
527,check the sentiment for adobe stock,stock_sentiment
528,how is the market feeling about kotak mahindra bank shares,stock_sentiment
529,whats the investor mood for netflix stock,stock_sentiment
530,are investors positive about maruti suzuki shares,stock_sentiment
531,tell me if apple stock is showing bearish sentiment,stock_sentiment
532,analyze the sentiment for asian paints shares,stock_sentiment
533,is the market optimistic about hdfc bank stock,stock_sentiment
534,how do traders feel about tesla shares today,stock_sentiment
535,check if infosys stock is trending bullish,stock_sentiment
536,tell me the current investor mood for icici bank stock,stock_sentiment
537,are traders bullish on reliance industries shares,stock_sentiment
538,whats the sentiment on tata steel stock,stock_sentiment
539,how is the market feeling about facebook shares,stock_sentiment
540,is the sentiment positive for microsoft stock,stock_sentiment
542,are investors confident about larsen toubro shares,stock_sentiment
543,check the market mood for sony stock,stock_sentiment
544,how do traders feel about bharat petroleum stock,stock_sentiment
545,whats the investor sentiment on tata power shares,stock_sentiment
546,are investors optimistic about zoom video stock,stock_sentiment
547,tell me if boeing stock is showing bullish trends,stock_sentiment
548,how is the market mood for bajaj finance stock,stock_sentiment
549,are traders bullish on hdfc life shares,stock_sentiment
550,whats the sentiment trend for icici prudential life stock,stock_sentiment
551,tell me if uber stock has positive investor sentiment,stock_sentiment
552,how do investors feel about tata consultancy services stock,stock_sentiment
553,check if reliance power shares are gaining bullish momentum,stock_sentiment
554,are traders optimistic about pfizer stock,stock_sentiment
555,whats the investor mood for bajaj auto shares,stock_sentiment
556,tell me if adobe shares are trending bullish,stock_sentiment
557,how is the market sentiment for mahindra electric stock,stock_sentiment
558,are investors positive about facebook stock,stock_sentiment
559,check the sentiment on tata chemicals shares,stock_sentiment
560,whats the market feeling about infosys stock today,stock_sentiment
561,tell me if icici bank shares are showing bearish signs,stock_sentiment
562,are traders bullish on maruti suzuki stock,stock_sentiment
563,how do investors feel about google stock,stock_sentiment
564,whats the sentiment on wipro stock,stock_sentiment
565,tell me if tesla shares are gaining positive sentiment,stock_sentiment
567,how is the market mood for amazon stock,stock_sentiment
568,check if microsoft stock is trending bullish,stock_sentiment
569,tell me the investor sentiment for larsen toubro stock,stock_sentiment
570,are investors confident about bajaj finance shares,stock_sentiment
571,whats the sentiment trend for tata motors stock,stock_sentiment
572,how do traders feel about netflix stock,stock_sentiment
573,tell me if icici prudential life stock is bullish,stock_sentiment
574,are investors positive about apple stock,stock_sentiment
575,whats the market feeling about bajaj auto stock,stock_sentiment
576,check if amazon shares are gaining bullish momentum,stock_sentiment
577,how do investors feel about tata steel stock,stock_sentiment
578,what is the current sentiment for axis bank stock,stock_sentiment
579,are investors bullish on hdfc shares today,stock_sentiment
580,analyze the market sentiment for itc stock,stock_sentiment
581,how is the investor mood for infosys stock,stock_sentiment
582,is the sentiment positive for reliance industries stock,stock_sentiment
583,tell me if tata steel shares are bullish or bearish,stock_sentiment
584,what do traders think about wipro stock,stock_sentiment
585,how do investors feel about adani enterprises shares,stock_sentiment
586,are the market sentiments favorable for bharti airtel stock,stock_sentiment
587,is there bullish momentum in asian paints shares,stock_sentiment
588,check the current investor sentiment on google stock,stock_sentiment
589,is tesla stock showing signs of bearish trend,stock_sentiment
590,how is the market sentiment for nestle india stock,stock_sentiment
591,tell me if amazon shares are gaining positive investor sentiment,stock_sentiment
592,whats the sentiment around maruti suzuki stock,stock_sentiment
593,are traders optimistic about bajaj finance stock,stock_sentiment
594,analyze the stock sentiment for pfizer shares,stock_sentiment
595,is the market mood bullish for icici bank stock,stock_sentiment
596,tell me if netflix stock is seeing positive investor interest,stock_sentiment
597,what is the sentiment for ultratech cement shares,stock_sentiment
598,are investors positive about microsoft stock,stock_sentiment
599,how do traders feel about sony stock today,stock_sentiment
600,whats the investor sentiment for tata motors shares,stock_sentiment
601,check if reliance power stock is bullish or bearish,stock_sentiment
602,how is the market feeling about hdfc life stock,stock_sentiment
603,are the investors optimistic about bharat petroleum shares,stock_sentiment
604,tell me if uber stock is showing bullish trends,stock_sentiment
605,whats the sentiment for bajaj auto stock today,stock_sentiment
606,how do investors feel about infosys shares,stock_sentiment
607,are traders confident about larsen toubro stock,stock_sentiment
608,is amazon stock being viewed positively by the market,stock_sentiment
609,what is the current mood for axis bank shares,stock_sentiment
610,tell me if hcl technologies stock is bullish,stock_sentiment
611,hows the market sentiment on tata consumer products stock,stock_sentiment
613,is the stock sentiment bullish for adani ports and sez,stock_sentiment
614,whats the current investor mood for paytm stock,stock_sentiment
615,check the sentiment trend for bajaj finance shares,stock_sentiment
616,are traders optimistic about google stock,stock_sentiment
617,how do investors feel about facebook shares,stock_sentiment
618,whats the market sentiment on mahindra mahindra stock,stock_sentiment
619,tell me if icici bank shares are trending bullish,stock_sentiment
620,are investors confident about tata power stock,stock_sentiment
621,how is the sentiment for nestle india shares,stock_sentiment
622,whats the sentiment around sony stock today,stock_sentiment
623,are traders positive about bajaj auto shares,stock_sentiment
624,check if maruti suzuki stock has bullish momentum,stock_sentiment
625,what do investors think about pfizer shares,stock_sentiment
626,is tesla stock being perceived negatively,stock_sentiment
627,how is the market feeling about ultratech cement shares,stock_sentiment
628,are traders optimistic about adobe stock,stock_sentiment
629,whats the investor sentiment on wipro shares,stock_sentiment
630,tell me if amazon stock is bullish or bearish today,stock_sentiment
631,are investors positive about tata steel stock,stock_sentiment
632,how do traders feel about hdfc bank stock,stock_sentiment
633,whats the market sentiment for reliance industries shares,stock_sentiment
634,is icici prudential life stock trending bullish,stock_sentiment
635,tell me if facebook stock is being viewed positively,stock_sentiment
637,what is the investor sentiment for sun pharma stock,stock_sentiment
638,is tesla stock gaining bullish momentum,stock_sentiment
639,how do traders view hdfc bank shares,stock_sentiment
640,are investors optimistic about reliance industries today,stock_sentiment
641,analyze market mood for google stock,stock_sentiment
642,is infosys stock showing signs of positive sentiment,stock_sentiment
643,whats the sentiment around tata motors shares,stock_sentiment
644,are traders bearish on amazon stock,stock_sentiment
645,tell me if bajaj finance shares are bullish,stock_sentiment
646,how is the market sentiment for adani enterprises,stock_sentiment
647,is microsoft stock viewed positively by investors,stock_sentiment
648,what do investors think about icici bank shares,stock_sentiment
649,are investors bullish on bharti airtel stock,stock_sentiment
650,how is the sentiment for maruti suzuki shares,stock_sentiment
652,are traders positive on wipro stock,stock_sentiment
653,what is the sentiment for larsen toubro shares,stock_sentiment
655,is the market mood bearish for netflix stock,stock_sentiment
656,whats the sentiment trend for bajaj auto shares,stock_sentiment
657,are investors confident about uber stock,stock_sentiment
658,tell me if ultratech cement shares are seeing positive sentiment,stock_sentiment
659,whats the current investor mood on icici prudential life,stock_sentiment
660,are traders optimistic about paytm stock,stock_sentiment
661,how do investors feel about sony shares,stock_sentiment
662,is the stock sentiment bullish for hcl technologies,stock_sentiment
663,check if tata consumer products stock is favored by investors,stock_sentiment
664,are investors positive on bajaj finance stock,stock_sentiment
665,whats the sentiment for nestle india shares,stock_sentiment
666,how do traders view mahindra mahindra stock,stock_sentiment
667,tell me if icici bank shares are bullish or bearish,stock_sentiment
669,whats the investor sentiment on google shares,stock_sentiment
670,is amazon stock showing bullish signals,stock_sentiment
671,how is the market feeling about axis bank stock,stock_sentiment
672,are traders optimistic about hdfc life shares,stock_sentiment
673,what is the sentiment for reliance power stock,stock_sentiment
674,tell me if bajaj auto shares are favored by investors,stock_sentiment
675,are investors positive about pfizer stock,stock_sentiment
676,whats the market mood on netflix shares,stock_sentiment
677,is tesla stock viewed negatively,stock_sentiment
678,how do investors feel about adobe stock,stock_sentiment
679,are traders bullish on facebook stock,stock_sentiment
680,tell me if hdfc bank stock is gaining positive sentiment,stock_sentiment
681,what is the investor sentiment on tata steel shares,stock_sentiment
682,are traders optimistic about infosys stock,stock_sentiment
683,how do investors view maruti suzuki shares,stock_sentiment
684,is icici prudential life stock showing signs of bullish momentum,stock_sentiment
685,whats the current sentiment for reliance industries stock,stock_sentiment
686,are investors confident about wipro shares,stock_sentiment
687,tell me if amazon stock is trending positive,stock_sentiment
688,what is the sentiment around bharti airtel stock,stock_sentiment
689,are traders bullish on tata motors stock,stock_sentiment
690,how is the market mood for uber shares,stock_sentiment
691,are investors optimistic about nestle india stock,stock_sentiment
692,is adani enterprises stock bullish or bearish,stock_sentiment
693,are investors positive or negative on icici bank stock,stock_sentiment
694,tell me if tata motors shares have a positive outlook,stock_sentiment
695,is itc stock trending positively,stock_sentiment
696,are investors positive or negative on tech mahindra stock,stock_sentiment
697,are traders optimistic about twitter stock,stock_sentiment
698,how are people reacting to apple shares,stock_sentiment
699,how is the market sentiment for bajaj finance stocks,stock_sentiment
700,analyze the stock sentiment for microsoft,stock_sentiment
701,whats the investor sentiment for sbi today,stock_sentiment
702,what is the sentiment of tech mahindra stock,stock_sentiment
703,how is adani enterprises stock sentiment trending,stock_sentiment
704,is hdfc bank stock trending positively,stock_sentiment
705,are paytm shares viewed positively right now,stock_sentiment
706,tell me if amazon stock is trending up,stock_sentiment
707,how is the market sentiment for sbi stocks,stock_sentiment
708,how is the sentiment on zomato shares,stock_sentiment
709,is infosys stock viewed as bullish currently,stock_sentiment
710,are tata steel shares seeing increased investor confidence,stock_sentiment
711,are jsw steel shares seeing positive sentiment,stock_sentiment
713,is itc stock showing bullish signs,stock_sentiment
714,is adani enterprises stock showing bullish signs,stock_sentiment
715,are wipro shares in a bullish mood,stock_sentiment
716,analyze the stock sentiment for flipkart,stock_sentiment
717,how is twitter stock sentiment trending,stock_sentiment
718,is jsw steel stock bullish or bearish,stock_sentiment
719,check the public sentiment for bharti airtel stock,stock_sentiment
720,is dell stock getting good reviews from traders,stock_sentiment
721,what is the sentiment of tesla stock,stock_sentiment
722,tell me if itc shares have a positive outlook,stock_sentiment
723,how are people reacting to tesla shares,stock_sentiment
724,check the public sentiment for hul stock,stock_sentiment
725,are traders optimistic about lic stock,stock_sentiment
726,whats the public sentiment for flipkart shares,stock_sentiment
727,is wipro stock showing bullish signs,stock_sentiment
728,is bharti airtel stock bullish or bearish,stock_sentiment
729,what is the sentiment of jsw steel stock,stock_sentiment
730,analyze tata motors stock sentiment from social media,stock_sentiment
731,how is dell stock sentiment trending,stock_sentiment
732,are investors confident in wipro shares,stock_sentiment
733,give me the current sentiment for jsw steel shares,stock_sentiment
734,analyze jsw steel stock sentiment from social media,stock_sentiment
735,check if tata motors stock is receiving positive feedback,stock_sentiment
737,is the amazon stock sentiment bullish or bearish,stock_sentiment
739,is tech mahindra stock trending positively,stock_sentiment
740,is adani enterprises stock trending positively,stock_sentiment
741,is dell stock bullish or bearish,stock_sentiment
742,are bharti airtel shares trending bullish currently,stock_sentiment
743,are investors confident in axis bank shares,stock_sentiment
744,how is the market sentiment for bharat electronics stocks,stock_sentiment
745,is the tata steel stock sentiment bullish or bearish,stock_sentiment
746,tell me if itc is going up or down,stock_sentiment
747,is uber stock sentiment favorable,stock_sentiment
748,analyze tata steel stock sentiment from social media,stock_sentiment
749,are investors positive or negative on amazon stock,stock_sentiment
750,tell me if reliance industries shares are favored by investors,stock_sentiment
751,check if twitter stock is receiving positive feedback,stock_sentiment
753,are microsoft shares viewed positively right now,stock_sentiment
754,how is the market sentiment for tata elxsi stocks,stock_sentiment
755,are ntpc shares seeing positive sentiment,stock_sentiment
756,check the public sentiment for apple stock,stock_sentiment
757,are investors positive or negative on byjus stock,stock_sentiment
760,are meta shares favored in todays market,stock_sentiment
761,are investors positive or negative on infosys stock,stock_sentiment
762,how is meta stock sentiment trending,stock_sentiment
764,tell me if bajaj finance shares are favored by investors,stock_sentiment
765,whats the investor mood around netflix stock,stock_sentiment
766,whats the public sentiment for bharat electronics shares,stock_sentiment
767,whats the investor mood around paytm stock,stock_sentiment
768,how is the sentiment on tata motors stock evolving,stock_sentiment
769,how are people reacting to itc shares,stock_sentiment
771,tell me if twitter shares are favored by investors,stock_sentiment
772,whats the public sentiment for wipro shares,stock_sentiment
773,check the public sentiment for byjus stock,stock_sentiment
775,how are people reacting to wipro shares,stock_sentiment
776,tell me if lic stock is trending up,stock_sentiment
778,is hul stock sentiment favorable,stock_sentiment
779,how is the sentiment on tata steel stock evolving,stock_sentiment
780,whats the public opinion on microsoft stock,stock_sentiment
781,tell me if infosys shares are favored by investors,stock_sentiment
782,are icici bank shares favored in todays market,stock_sentiment
783,is ongc stock sentiment favorable,stock_sentiment
784,is tata steel stock sentiment favorable,stock_sentiment
785,whats the general market sentiment on meta stock,stock_sentiment
786,are investors positive or negative on axis bank stock,stock_sentiment
787,tell me if flipkart stock is trending up,stock_sentiment
788,tell me if microsoft shares are favored by investors,stock_sentiment
789,analyze tata motorss stock sentiment from recent news,stock_sentiment
791,tell me if amazon is going up or down,stock_sentiment
792,tell me if uber stock is trending up,stock_sentiment
793,is zomato stock getting good reviews from traders,stock_sentiment
794,whats the investor sentiment on infosys stock,stock_sentiment
795,are bharat electronics shares viewed positively right now,stock_sentiment
796,is tech mahindra stock getting good reviews from traders,stock_sentiment
797,is icici bank stock showing bullish signs,stock_sentiment
798,whats the investor mood around microsoft stock,stock_sentiment
799,whats the mood around tech mahindra stock today,stock_sentiment
800,whats the public sentiment for marico shares,stock_sentiment
801,how are uber shares perceived by traders,stock_sentiment
802,how are flipkart shares perceived by traders,stock_sentiment
803,how is the market feeling about tata motors,stock_sentiment
804,is apple stock trending positively,stock_sentiment
805,how are people reacting to amazon shares,stock_sentiment
806,is adani enterprises stock getting good reviews from traders,stock_sentiment
807,how are people reacting to uber shares,stock_sentiment
808,is sbi stock trending positively,stock_sentiment
810,analyze asian paintss stock sentiment from recent news,stock_sentiment
811,whats the investor sentiment on tata motors stock,stock_sentiment
813,whats the general market sentiment on netflix stock,stock_sentiment
814,whats the investor sentiment for dell today,stock_sentiment
815,tell me if tesla shares are favored by investors,stock_sentiment
816,check if microsoft stock is receiving positive feedback,stock_sentiment
817,whats the investor mood around uber stock,stock_sentiment
818,check if icici bank stock is receiving positive feedback,stock_sentiment
819,how are people reacting to axis bank shares,stock_sentiment
820,whats the mood around tata elxsi stock today,stock_sentiment
821,whats the mood around bharat electronics stock today,stock_sentiment
822,is the lic stock sentiment bullish or bearish,stock_sentiment
823,is ntpc stock showing positive signs,stock_sentiment
824,analyze twitter stock sentiment from social media,stock_sentiment
825,how is amazon stock sentiment trending,stock_sentiment
826,whats the mood around ongc stock today,stock_sentiment
827,is paytm stock bullish or bearish,stock_sentiment
828,how is the sentiment on reliance industries shares,stock_sentiment
829,are tata elxsi shares in a bullish mood,stock_sentiment
832,is facebook stock showing bullish signs,stock_sentiment
833,how is the sentiment on zomato stock evolving,stock_sentiment
834,tell me if uber shares are favored by investors,stock_sentiment
835,are investors positive or negative on meta stock,stock_sentiment
837,whats the investor sentiment for tech mahindra today,stock_sentiment
838,tell me if axis bank is going up or down,stock_sentiment
839,analyze amazons stock sentiment from recent news,stock_sentiment
