,text,intent
0,what is the sentiment of apple stock,stock_sentiment
1,tell me if tesla is going up or down,stock_sentiment
2,analyze the stock sentiment for microsoft,stock_sentiment
3,is amazon stock bullish or bearish,stock_sentiment
4,how is the market feeling about nvidia,stock_sentiment
5,give me the current sentiment for google stock,stock_sentiment
6,whats the investor sentiment on facebook shares,stock_sentiment
7,are investors positive or negative on netflix stock,stock_sentiment
8,check the sentiment for intel stock,stock_sentiment
9,how are people reacting to twitter shares,stock_sentiment
10,is the market optimistic about amd stock,stock_sentiment
11,tell me if apple shares are trending up or down,stock_sentiment
12,whats the mood around tesla stock today,stock_sentiment
13,is the sentiment bullish for microsoft right now,stock_sentiment
14,are amazon shares expected to rise,stock_sentiment
15,analyze how investors feel about nvidia stock,stock_sentiment
16,whats the overall sentiment for google today,stock_sentiment
17,is facebook stock considered risky currently,stock_sentiment
18,how do traders feel about netflix shares,stock_sentiment
19,check if intel stock is under positive sentiment,stock_sentiment
20,are investors optimistic about twitters stock,stock_sentiment
21,whats the latest sentiment on amd shares,stock_sentiment
22,tell me if apples stock is gaining positive buzz,stock_sentiment
23,whats the current trend for tesla stock,stock_sentiment
24,are microsoft shares seeing positive sentiment,stock_sentiment
25,is amazon stock getting good reviews from traders,stock_sentiment
26,how is the market sentiment for nvidia stocks,stock_sentiment
27,give me sentiment analysis for google stock,stock_sentiment
28,are investors confident in facebook shares,stock_sentiment
29,check the public sentiment for netflix stock,stock_sentiment
30,is intel stock showing positive signs,stock_sentiment
31,how are twitter shares perceived by traders,stock_sentiment
32,is the amd stock sentiment bullish or bearish,stock_sentiment
33,whats the investor sentiment for apple today,stock_sentiment
34,are traders optimistic about tesla stock,stock_sentiment
35,is microsoft stock trending positively,stock_sentiment
36,tell me if amazon shares have a positive outlook,stock_sentiment
37,analyze nvidias stock sentiment from recent news,stock_sentiment
38,whats the general market sentiment on google stock,stock_sentiment
39,are facebook shares viewed positively right now,stock_sentiment
40,how do investors feel about netflix stock recently,stock_sentiment
41,check the sentiment for intel shares today,stock_sentiment
42,is twitters stock sentiment favorable,stock_sentiment
43,are amd stocks in a bullish mood,stock_sentiment
44,whats the public opinion on apple stock,stock_sentiment
45,tell me if tesla shares are favored by investors,stock_sentiment
46,how is the sentiment on microsoft shares,stock_sentiment
47,is amazon stock viewed as bullish currently,stock_sentiment
48,analyze market sentiment for nvidia shares,stock_sentiment
49,whats the trend for google stock sentiment,stock_sentiment
50,are facebook shares considered stable by traders,stock_sentiment
51,how do investors perceive netflix stock right now,stock_sentiment
52,check if intel shares are in positive sentiment,stock_sentiment
53,is twitter stock sentiment trending upward,stock_sentiment
54,are amd stocks gaining positive feedback,stock_sentiment
55,whats the overall feeling about apple stock,stock_sentiment
56,are tesla shares gaining positive momentum,stock_sentiment
57,tell me if microsoft stock is bullish or bearish,stock_sentiment
58,is amazon shares sentiment positive today,stock_sentiment
59,analyze nvidia stock sentiment from social media,stock_sentiment
60,whats the public sentiment for google shares,stock_sentiment
61,are facebook shares seeing increased investor confidence,stock_sentiment
62,how is netflix stock sentiment trending,stock_sentiment
63,check if intel stock is receiving positive feedback,stock_sentiment
64,is twitter stock sentiment positive or negative,stock_sentiment
65,are amd shares trending bullish currently,stock_sentiment
66,whats the investor mood around apple stock,stock_sentiment
67,are tesla shares favored in todays market,stock_sentiment
68,how is the sentiment on microsoft stock evolving,stock_sentiment
69,is amazon stock considered bullish right now,stock_sentiment
70,analyze nvidias stock sentiment from recent trends,stock_sentiment
71,whats the general sentiment for google shares,stock_sentiment
72,are facebook stocks viewed positively by investors,stock_sentiment
73,how do traders feel about netflix stock today,stock_sentiment
74,check the sentiment trend for intel shares,stock_sentiment
75,is twitter stock sentiment improving,stock_sentiment
76,are amd shares receiving positive market sentiment,stock_sentiment
77,whats the overall sentiment on apple shares,stock_sentiment
78,are tesla shares trending up in sentiment,stock_sentiment
79,tell me if microsoft stock sentiment is positive,stock_sentiment
80,is amazon stock sentiment bullish or bearish,stock_sentiment
81,analyze nvidia stock sentiment from latest news,stock_sentiment
82,whats the market sentiment for google shares,stock_sentiment
83,are facebook shares seen as good investments now,stock_sentiment
84,how is netflix stock sentiment trending lately,stock_sentiment
85,check if intel shares have positive investor sentiment,stock_sentiment
86,is twitter stock sentiment currently positive,stock_sentiment
87,are amd shares favored by investors recently,stock_sentiment
88,what is the sentiment of reliance industries stock,stock_sentiment
89,tell me if tcs is trending up or down,stock_sentiment
90,analyze the stock sentiment for infosys,stock_sentiment
91,is hdfc bank stock bullish or bearish,stock_sentiment
92,how is the market feeling about icici bank,stock_sentiment
93,give me the current sentiment for larsen toubro stock,stock_sentiment
94,whats the investor sentiment on sbi shares,stock_sentiment
95,are investors positive or negative on bharti airtel stock,stock_sentiment
96,check the sentiment for asian paints stock,stock_sentiment
97,how are people reacting to bajaj finance shares,stock_sentiment
98,is the market optimistic about maruti suzuki stock,stock_sentiment
99,tell me if reliance industries shares are trending up or down,stock_sentiment
100,whats the mood around tcs stock today,stock_sentiment
101,is the sentiment bullish for infosys right now,stock_sentiment
102,are hdfc bank shares expected to rise,stock_sentiment
103,analyze how investors feel about icici bank stock,stock_sentiment
104,whats the overall sentiment for larsen toubro today,stock_sentiment
105,is sbi stock considered risky currently,stock_sentiment
106,how do traders feel about bharti airtel shares,stock_sentiment
107,check if asian paints stock is under positive sentiment,stock_sentiment
108,are investors optimistic about bajaj finances stock,stock_sentiment
109,whats the latest sentiment on maruti suzuki shares,stock_sentiment
110,tell me if reliance industries stock is gaining positive buzz,stock_sentiment
111,whats the current trend for tcs stock,stock_sentiment
112,are infosys shares seeing positive sentiment,stock_sentiment
113,is hdfc bank stock getting good reviews from traders,stock_sentiment
114,how is the market sentiment for icici bank stocks,stock_sentiment
115,give me sentiment analysis for larsen toubro stock,stock_sentiment
116,are investors confident in sbi shares,stock_sentiment
117,check the public sentiment for bharti airtel stock,stock_sentiment
118,is asian paints stock showing positive signs,stock_sentiment
119,how are bajaj finance shares perceived by traders,stock_sentiment
120,is the maruti suzuki stock sentiment bullish or bearish,stock_sentiment
121,whats the investor sentiment for reliance industries today,stock_sentiment
122,are traders optimistic about tcs stock,stock_sentiment
123,is infosys stock trending positively,stock_sentiment
124,tell me if hdfc bank shares have a positive outlook,stock_sentiment
125,analyze icici banks stock sentiment from recent news,stock_sentiment
126,whats the general market sentiment on larsen toubro stock,stock_sentiment
127,are sbi shares viewed positively right now,stock_sentiment
128,how do investors feel about bharti airtel stock recently,stock_sentiment
129,check the sentiment for asian paints shares today,stock_sentiment
130,is bajaj finance stock sentiment favorable,stock_sentiment
131,are maruti suzuki stocks in a bullish mood,stock_sentiment
132,whats the public opinion on reliance industries stock,stock_sentiment
133,tell me if tcs shares are favored by investors,stock_sentiment
134,how is the sentiment on infosys shares,stock_sentiment
135,is hdfc bank stock viewed as bullish currently,stock_sentiment
136,analyze icici bank stock sentiment from social media,stock_sentiment
137,whats the public sentiment for larsen toubro shares,stock_sentiment
138,are sbi shares seeing increased investor confidence,stock_sentiment
139,how is bharti airtel stock sentiment trending,stock_sentiment
140,check if asian paints stock is receiving positive feedback,stock_sentiment
141,is bajaj finance stock sentiment positive or negative,stock_sentiment
142,are maruti suzuki shares trending bullish currently,stock_sentiment
143,whats the investor mood around reliance industries stock,stock_sentiment
144,are tcs shares favored in todays market,stock_sentiment
145,how is the sentiment on infosys stock evolving,stock_sentiment
146,is hdfc bank stock considered bullish right now,stock_sentiment
147,analyze icici banks stock sentiment from recent trends,stock_sentiment
148,whats the general sentiment for larsen toubro shares,stock_sentiment
149,are sbi stocks viewed positively by investors,stock_sentiment
150,how do traders feel about bharti airtel stock today,stock_sentiment
151,check the sentiment trend for asian paints shares,stock_sentiment
152,is bajaj finance stock sentiment improving,stock_sentiment
153,are maruti suzuki shares receiving positive market sentiment,stock_sentiment
154,whats the overall sentiment on reliance industries shares,stock_sentiment
155,are tcs shares trending up in sentiment,stock_sentiment
156,tell me if infosys stock sentiment is positive,stock_sentiment
157,is hdfc bank stock sentiment bullish or bearish,stock_sentiment
158,analyze icici bank stock sentiment from latest news,stock_sentiment
159,whats the market sentiment for larsen toubro shares,stock_sentiment
160,are sbi shares seen as good investments now,stock_sentiment
161,how is bharti airtel stock sentiment trending lately,stock_sentiment
162,check if asian paints shares have positive investor sentiment,stock_sentiment
163,is bajaj finance stock sentiment currently positive,stock_sentiment
164,are maruti suzuki shares favored by investors recently,stock_sentiment
169,how is the market feeling about infosys,stock_sentiment
170,give me the current sentiment for apple shares,stock_sentiment
171,whats the investor sentiment on tcs stock,stock_sentiment
172,are investors positive or negative on google stock,stock_sentiment
173,check the sentiment for icici bank stock,stock_sentiment
174,how are people reacting to nvidia shares,stock_sentiment
175,is hdfc bank stock showing bullish signs,stock_sentiment
176,tell me if facebook stock is trending up,stock_sentiment
177,whats the mood around amazon stock today,stock_sentiment
181,give me sentiment analysis for tesla stock,stock_sentiment
188,are traders optimistic about apple stock,stock_sentiment
197,are maruti suzuki shares in a bullish mood,stock_sentiment
199,tell me if netflix shares are favored by investors,stock_sentiment
231,what is the sentiment of cocacola stock,stock_sentiment
232,is google stock showing a positive trend,stock_sentiment
233,analyze the sentiment for walmart shares,stock_sentiment
234,is ibm stock bullish or bearish,stock_sentiment
235,what is the sentiment on netflix shares,stock_sentiment
236,how is the market sentiment on pfizer stock,stock_sentiment
237,are investors optimistic about adobe stock,stock_sentiment
238,whats the sentiment on zoom video communications stock,stock_sentiment
239,is boeing stock viewed positively by traders,stock_sentiment
240,analyze sentiment for exxonmobil shares,stock_sentiment
241,is twitter stock trending up or down,stock_sentiment
242,tell me the market feeling about spotify stock,stock_sentiment
243,are investors bullish on uber technologies,stock_sentiment
244,whats the sentiment for paypal stock,stock_sentiment
245,is the sentiment positive for shopify stock,stock_sentiment
246,what is the current sentiment for adani enterprises stock,stock_sentiment
247,how are investors feeling about wipro shares,stock_sentiment
248,analyze the sentiment around paytm stock,stock_sentiment
249,is bajaj auto stock showing bullish trends,stock_sentiment
250,whats the market mood on tata steel shares,stock_sentiment
251,tell me if ford stock is trending positively,stock_sentiment
252,check the sentiment for hcl technologies shares,stock_sentiment
253,are investors optimistic about netflix stock,stock_sentiment
254,how is the sentiment on asian paints stock,stock_sentiment
255,is sony stock bullish or bearish today,stock_sentiment
256,whats the investor sentiment on itc stock,stock_sentiment
257,how do traders feel about ford shares recently,stock_sentiment
258,check sentiment for cipla stock,stock_sentiment
259,is tesla stock viewed positively by investors now,stock_sentiment
260,whats the sentiment on maruti suzuki shares,stock_sentiment
261,tell me if axis bank shares are favored by traders,stock_sentiment
262,analyze the market sentiment for google stock,stock_sentiment
263,are investors positive about britannia industries shares,stock_sentiment
264,how is the sentiment on reliance industries today,stock_sentiment
265,is zoom stock trending up in investor sentiment,stock_sentiment
266,whats the public opinion on coal india stock,stock_sentiment
267,check if pfizer shares have bullish sentiment,stock_sentiment
268,are bharti airtel shares viewed favorably by investors,stock_sentiment
269,how do traders feel about microsoft stock lately,stock_sentiment
270,is infosys stock receiving positive market feedback,stock_sentiment
271,what is the market mood on icici bank shares,stock_sentiment
272,are investors optimistic about amazon stock,stock_sentiment
273,tell me the sentiment trend for wipro shares,stock_sentiment
274,how is the sentiment for apple stock evolving,stock_sentiment
275,is larsen toubro stock showing positive signs,stock_sentiment
276,analyze the sentiment of tesla stock from social media,stock_sentiment
277,are sbi shares viewed as bullish right now,stock_sentiment
278,what is the current sentiment on google shares,stock_sentiment
279,how are traders feeling about tata motors stock,stock_sentiment
280,is uber technologies stock trending positively,stock_sentiment
281,check the sentiment for nestle india shares,stock_sentiment
282,whats the investor mood on bajaj finance stock,stock_sentiment
283,tell me if facebook stock is bullish or bearish,stock_sentiment
284,how is the sentiment on hdfc bank stock,stock_sentiment
285,are investors confident in paytm shares,stock_sentiment
286,what is the sentiment on netflix shares today,stock_sentiment
287,is reliance industries stock viewed positively by traders,stock_sentiment
288,how do investors feel about axis bank stock,stock_sentiment
289,check if cocacola shares have positive sentiment,stock_sentiment
290,what is the market sentiment for tata steel shares,stock_sentiment
291,are traders optimistic about sony stock,stock_sentiment
292,how is the sentiment trend for icici bank shares,stock_sentiment
293,tell me if microsoft stock is receiving positive reviews,stock_sentiment
294,analyze the sentiment on wipro stock from recent news,stock_sentiment
295,are investors bullish on bajaj auto shares,stock_sentiment
296,whats the sentiment on asian paints stock currently,stock_sentiment
297,how do traders view larsen toubro stock,stock_sentiment
298,is amazon stock trending positively today,stock_sentiment
299,whats the market feeling about pfizer stock,stock_sentiment
300,are investors optimistic about uber technologies stock,stock_sentiment
301,tell me if facebook shares are trending bullish,stock_sentiment
302,how is the sentiment on nestle india stock,stock_sentiment
303,check the public sentiment for britannia industries stock,stock_sentiment
304,is cocacola stock viewed favorably by traders,stock_sentiment
305,analyze the market sentiment on ford stock,stock_sentiment
306,are tesla shares bullish or bearish right now,stock_sentiment
307,whats the sentiment for bajaj finance shares,stock_sentiment
308,tell me if infosys stock is trending positively,stock_sentiment
309,how is the sentiment on axis bank stock evolving,stock_sentiment
310,are investors confident about tata motors shares,stock_sentiment
311,whats the current market sentiment for hcl technologies,stock_sentiment
312,is reliance industries stock sentiment bullish today,stock_sentiment
313,check the investor sentiment for icici bank shares,stock_sentiment
314,how do traders feel about microsoft stock,stock_sentiment
315,whats the general mood about netflix stock,stock_sentiment
316,tell me if tata steel shares are favored by investors,stock_sentiment
317,is uber stock viewed positively by market participants,stock_sentiment
318,analyze the sentiment for amazon shares from social media,stock_sentiment
319,are facebook shares trending up or down,stock_sentiment
320,whats the current sentiment on apple stock,stock_sentiment
321,whats the investor sentiment on dr reddys laboratories shares,stock_sentiment
322,how is the market feeling about qualcomm stock,stock_sentiment
323,is the sentiment positive for state bank of india shares,stock_sentiment
324,tell me the current mood around goldman sachs stock,stock_sentiment
325,are investors bullish on icici prudential life shares,stock_sentiment
326,analyze the sentiment on johnson johnson stock,stock_sentiment
327,what is the general sentiment for larsen toubro infotech stock,stock_sentiment
328,how are traders feeling about mahindra mahindra shares,stock_sentiment
329,is the market sentiment optimistic for boeing stock,stock_sentiment
330,check the sentiment for nestle india stock,stock_sentiment
331,whats the sentiment trend for hdfc life shares,stock_sentiment
332,are investors positive about apple inc stock recently,stock_sentiment
333,how do market participants view axis bank shares now,stock_sentiment
334,tell me if tata consultancy services shares have bullish sentiment,stock_sentiment
335,what is the investor mood on facebook stock,stock_sentiment
336,analyze the sentiment for infosys stock from recent reports,stock_sentiment
337,are traders optimistic about netflix shares,stock_sentiment
338,how is the sentiment on adani ports stock,stock_sentiment
339,whats the sentiment for tesla stock after latest earnings,stock_sentiment
340,tell me if reliance industries shares are favored by investors today,stock_sentiment
341,how do investors feel about pepsico stock,stock_sentiment
342,is the market mood positive for bajaj finance shares,stock_sentiment
343,check if wipro stock is bullish or bearish,stock_sentiment
344,what is the sentiment on maruti suzuki stock currently,stock_sentiment
345,are investors confident about bharti airtel shares,stock_sentiment
346,how do traders view cisco systems stock,stock_sentiment
347,is tata power stock trending up or down in sentiment,stock_sentiment
348,whats the investor sentiment on uber technologies shares,stock_sentiment
349,tell me if bajaj auto stock is viewed positively by traders,stock_sentiment
350,how is the sentiment on johnson controls stock,stock_sentiment
351,are investors bullish on oil and natural gas corporation shares,stock_sentiment
352,what is the current sentiment trend for facebook stock,stock_sentiment
353,analyze the market mood for icici bank shares,stock_sentiment
354,is the sentiment favorable for britannia industries shares,stock_sentiment
355,how do investors feel about qualcomm shares,stock_sentiment
356,what is the sentiment on tata chemicals stock,stock_sentiment
357,tell me if apple stock has positive sentiment this week,stock_sentiment
358,are traders optimistic about infosys shares currently,stock_sentiment
359,how is the market sentiment on siemens india stock,stock_sentiment
360,whats the investor mood on ford motor company shares,stock_sentiment
361,is reliance industries stock trending positively this month,stock_sentiment
362,check sentiment for tata steel shares,stock_sentiment
363,are investors confident about nestle india stock,stock_sentiment
364,tell me if microsoft stock is bullish or bearish today,stock_sentiment
365,whats the sentiment for asian paints shares,stock_sentiment
366,analyze the current sentiment on bajaj finance stock,stock_sentiment
367,is the investor sentiment positive for tata motors shares,stock_sentiment
368,how do traders feel about amazon stock now,stock_sentiment
369,what is the market sentiment on hdfc bank stock,stock_sentiment
370,are investors bullish on bharti airtel stock today,stock_sentiment
371,tell me the general sentiment for tesla stock,stock_sentiment
372,how is the sentiment on infosys stock trending,stock_sentiment
373,is wipro stock receiving positive market feedback,stock_sentiment
374,whats the investor mood on icici prudential life shares,stock_sentiment
375,analyze sentiment trends for maruti suzuki stock,stock_sentiment
376,are traders optimistic about tata power shares,stock_sentiment
377,whats the sentiment for state bank of india stock,stock_sentiment
378,tell me if uber stock has positive sentiment currently,stock_sentiment
379,how do investors feel about pfizer shares,stock_sentiment
380,is the market sentiment favorable for larsen toubro infotech,stock_sentiment
381,whats the current investor sentiment on apple stock,stock_sentiment
383,what is the investor mood on tata steel shares,stock_sentiment
384,are traders optimistic about reliance industries stock,stock_sentiment
385,tell me if infosys stock is bullish or bearish today,stock_sentiment
386,how is the market sentiment on microsoft shares,stock_sentiment
387,is the investor sentiment positive for icici bank shares,stock_sentiment
388,whats the sentiment for bajaj finance stock,stock_sentiment
389,analyze the sentiment for tesla stock,stock_sentiment
390,are investors confident about hdfc bank stock,stock_sentiment
391,how do traders feel about amazon shares,stock_sentiment
392,tell me the current sentiment on tata consultancy services stock,stock_sentiment
393,what is the market mood for bharti airtel shares,stock_sentiment
394,is the sentiment favorable for larsen toubro stock,stock_sentiment
395,how is the investor sentiment on facebook stock,stock_sentiment
396,check if apple stock has bullish sentiment today,stock_sentiment
397,are traders optimistic about nestle india shares,stock_sentiment
398,what is the sentiment trend for state bank of india stock,stock_sentiment
399,tell me if wipro stock is viewed positively by investors,stock_sentiment
400,how do investors feel about boeing stock,stock_sentiment
401,is the market mood optimistic for johnson johnson shares,stock_sentiment
402,analyze the sentiment for tata motors stock,stock_sentiment
403,are investors bullish on mahindra mahindra stock,stock_sentiment
404,whats the current investor sentiment on netflix shares,stock_sentiment
405,how is the sentiment on pfizer stock,stock_sentiment
406,tell me if icici prudential life shares have positive sentiment,stock_sentiment
407,check the sentiment for uber technologies stock,stock_sentiment
408,is the investor mood positive for asian paints shares,stock_sentiment
409,whats the market sentiment for tata chemicals stock,stock_sentiment
410,are traders optimistic about reliance power stock,stock_sentiment
411,how do investors feel about cisco systems shares,stock_sentiment
412,tell me the sentiment on johnson controls stock,stock_sentiment
413,is the market mood bullish for bajaj auto shares,stock_sentiment
414,analyze the investor sentiment for ford motor company stock,stock_sentiment
415,are investors confident about oil and natural gas corporation shares,stock_sentiment
416,whats the sentiment trend for britannia industries stock,stock_sentiment
417,tell me if tesla stock is viewed positively by traders,stock_sentiment
418,how is the sentiment on hdfc life shares,stock_sentiment
419,check the current investor sentiment on maruti suzuki stock,stock_sentiment
420,are investors bullish on tata power stock,stock_sentiment
421,whats the sentiment for infosys shares,stock_sentiment
422,tell me if facebook stock has positive sentiment now,stock_sentiment
423,how do traders feel about bajaj finance stock,stock_sentiment
424,is the investor mood favorable for icici bank shares,stock_sentiment
425,what is the sentiment on nestle india stock,stock_sentiment
426,are traders optimistic about larsen toubro infotech stock,stock_sentiment
427,tell me if amazon stock is bullish or bearish,stock_sentiment
428,how is the market feeling about qualcomm shares,stock_sentiment
429,whats the investor sentiment on tata steel shares,stock_sentiment
431,analyze the sentiment for microsoft stock,stock_sentiment
432,is the market mood positive for apple inc stock,stock_sentiment
433,tell me if wipro stock is bullish or bearish today,stock_sentiment
