,Unnamed: 0,text,intent
851,851,i want a brief summary of the voice chat,voice_summary
852,852,voice message gist in a few lines,voice_summary
853,853,whats this audio clip about,voice_summary
854,854,give a wrapup of this voice message,voice_summary
855,855,summarize the voice log,voice_summary
856,856,whats the essential message here,voice_summary
857,857,voice memo short description,voice_summary
858,858,outline what this speaker said,voice_summary
859,859,make this voice message readable as a summary,voice_summary
860,860,explain the voice note in short,voice_summary
861,861,compress this voice message info,voice_summary
862,862,distill the content of the voice clip,voice_summary
863,863,voice summary in under 50 words,voice_summary
864,864,tell me the essence of the recording,voice_summary
865,865,main idea spoken in voice clip,voice_summary
866,866,recap of the voice message,voice_summary
867,867,shortened version of speakers words,voice_summary
868,868,speakers summary needed,voice_summary
869,869,whats in this voice clip in short,voice_summary
870,870,summarize the communication in this audio,voice_summary
871,871,voice overview required,voice_summary
872,872,give me a breakdown of the voice,voice_summary
873,873,can you draft a short summary of this voice,voice_summary
874,874,speakers message condensed,voice_summary
875,875,short report from this voice note,voice_summary
876,876,voice idea in simple terms,voice_summary
877,877,gist of the audio file,voice_summary
878,878,voice content recap,voice_summary
879,879,short version of whats recorded here,voice_summary
880,880,give me the key info from this voice,voice_summary
881,881,voice transcript summary,voice_summary
882,882,abstract of voice message,voice_summary
883,883,voice note takeaway,voice_summary
884,884,summarize whats being talked about in the voice,voice_summary
885,885,short form of the voice dialogue,voice_summary
886,886,wrap up the points discussed in the voice,voice_summary
887,887,give me a 3point summary,voice_summary
888,888,summarize message into readable lines,voice_summary
889,889,need a precise version of voice content,voice_summary
890,890,short content of voice file,voice_summary
891,891,condensed speaker voice,voice_summary
892,892,extract voice summary automatically,voice_summary
893,893,voice speech in short,voice_summary
894,894,recap the voice,voice_summary
895,895,make the audio message short and crisp,voice_summary
896,896,audio clip gist,voice_summary
897,897,shorten this voice chat,voice_summary
898,898,what was said in this voice briefly,voice_summary
899,899,extract a concise explanation from the voice,voice_summary
900,900,voice file give me the quick summary,voice_summary
901,901,compress and summarize audio,voice_summary
902,902,speakers key insights in short form,voice_summary
